,author id,created_at,geo,id,lang,like_count,quote_count,reply_count,retweet_count,positive SA value,Negative SA values,Compound,source,tweet
1237,4898091,2020-02-13 15:28:47+00:00, ,1.22798E+18,en,0,0,0,15,,,,SocialFlow,"RT @htsi: Our new look How To Spend It, starring supermodel Malgosia Bela, is out this weekend. We’re pretty excited to share it with you.…"
1236,4898091,2020-02-13 15:40:06+00:00, ,1.22798E+18,en,6,0,0,5,,,,SocialFlow,"Will Boris Johnson keep his promise to ‘Get Brexit Done’? Join @SebastianEPayne and guests for a live recording of the FT’s UK Politics Podcast on February 26
https://t.co/5SmtnFxji8 https://t.co/Fs5vTiljJF"
1235,4898091,2020-02-13 16:00:26+00:00, ,1.22799E+18,en,5,0,0,3,,,,SocialFlow,"Fifteen months since the ousting of its former chairman Carlos Ghosn, Nissan’s new boss Makoto Uchida admitted a full recovery in 2020 was off the table even before the coronavirus outbreak hit its supply chain https://t.co/hOO5s0ugBY"
1233,4898091,2020-02-13 16:40:09+00:00, ,1.228E+18,en,4,0,0,3,,,,SocialFlow,"The world's largest social network has banned pages linked to telecoms providers in Vietnam and Myanmar
https://t.co/TMARYoNyU6"
1231,4898091,2020-02-13 17:20:08+00:00, ,1.22801E+18,en,21,3,0,6,,,,SocialFlow,"Leopoldstadt is Tom Stoppard's first play for five years – a moving, teeming, 'momentous' drama about a Viennese Jewish family. It gets ★★★★☆ from the FT: https://t.co/DQsQlP0Omo"
1230,4898091,2020-02-13 17:40:13+00:00, ,1.22801E+18,en,16,1,1,3,,,,SocialFlow,"Speaking outside of his home, Sajid Javid, the former UK chancellor, explained his decision to stand down from government saying that he 'felt he was left with no option other than to resign'. Follow live updates and analysis here: https://t.co/ES3qvaWZKl https://t.co/6AMUUuDuo3"
1229,4898091,2020-02-13 18:00:10+00:00, ,1.22802E+18,en,10,2,3,6,,,,SocialFlow,"Martin Wolf: Glib slogans will not fix any of this. In the end, reality bites
https://t.co/xMFKWx9qTs"
1228,4898091,2020-02-13 18:20:08+00:00, ,1.22802E+18,en,26,2,4,8,,,,SocialFlow,"On Thursday two New York billionaires publicly denigrated each other, with one making fun of his rival’s stature and the other claiming fellow friends laugh about his adversary’s failed real estate investments. Can you guess who they were? https://t.co/3R59LJmA7h"
1225,4898091,2020-02-13 19:20:09+00:00, ,1.22804E+18,en,17,0,1,7,,,,SocialFlow,Europe’s two-party political landscape has been upended — what’s left in the aftermath and what’s next? Read Philip Stephens’s latest column to find out more https://t.co/IjbgSidd5r
1224,4898091,2020-02-13 19:40:07+00:00, ,1.22804E+18,en,8,0,1,9,,,,SocialFlow,US presidential candidate Pete Buttigieg is facing criticism on race relations in his hometown. Critics point to racially-charged controversy during his 8 years as mayor https://t.co/xdz3vfojUU
1221,4898091,2020-02-13 20:40:09+00:00, ,1.22806E+18,en,26,0,0,15,,,,SocialFlow,"Amazon has won a request to temporarily block a $10bn US defence contract awarded to rival Microsoft, after accusing the Trump administration of having shown 'unmistakable bias' in its procurement process https://t.co/WB5jOY6xii"
1217,4898091,2020-02-13 21:40:11+00:00, ,1.22807E+18,en,15,0,3,6,,,,SocialFlow,Thursday was a dramatic day for Boris Johnson as he reshuffled his cabinet. Economists and political scientists all agreed that the PM's new policies will increase public spending and downgrade fiscal prudence. So what now for the UK's economy? https://t.co/0mTRQu32Qp
1216,4898091,2020-02-13 22:00:11+00:00, ,1.22808E+18,en,14,1,2,4,,,,SocialFlow,"The US Senate has voted to limit Donald Trump’s military authority in Iran, with eight Republicans supporting the Democratic-sponsored measure triggered by the president’s decision to kill the top Iranian military commander Qassem Soleimani https://t.co/nwPTMBCx5p"
1210,4898091,2020-02-13 23:40:08+00:00, ,1.2281E+18,en,22,2,1,11,,,,SocialFlow,"Brazilians’ views on a spectrum of social issues, from abortion to gay marriage and the death penalty, have grown more conservative https://t.co/6tBk9LJk5i"
1209,4898091,2020-02-14 00:30:08+00:00, ,1.22811E+18,en,19,3,2,5,,,,SocialFlow,New York Fashion Week has lost its star power. The same could be said for American fashion. But why? https://t.co/WIVpQzoJiH
1208,4898091,2020-02-14 01:00:13+00:00, ,1.22812E+18,en,38,5,4,12,,,,SocialFlow,"We need to think about quitting in a new way, writes Elizabeth Uviebinene. Rather than see it as a fearful end in itself, we need to see it as a chance for a new beginning 
https://t.co/VALbnywCkq"
1206,4898091,2020-02-14 01:47:21+00:00, ,1.22813E+18,en,23,2,0,23,,,,SocialFlow,"Coronavirus latest: China’s Hubei province reports 4,823 new cases and 116 deaths https://t.co/AI8E7Jy7rs"
1205,4898091,2020-02-14 02:00:12+00:00, ,1.22814E+18,en,0,0,0,2,,,,SocialFlow,"RT @emmavj: Mr Loeb renamed the vessel Samadhi, a Buddhist term for a state of meditative consciousness and enlightenment, and now offers i…"
1202,4898091,2020-02-14 03:00:08+00:00, ,1.22815E+18,en,0,0,0,8,,,,SocialFlow,"RT @estherbintliff: ""My grandpa texted me: 'Viruses are scared of acid. . . dab a cotton bud with strong vinegar and stick it inside your n…"
1201,4898091,2020-02-14 03:30:05+00:00, ,1.22816E+18,en,15,1,1,9,,,,SocialFlow,"Chinese authorities reported 121 new coronavirus deaths to the end of Thursday, while Japan reported four new cases and a first fatality, raising fears of the outbreak’s spread. Follow our live coverage here: https://t.co/HHUYNbM8Vj"
1200,4898091,2020-02-14 04:20:08+00:00, ,1.22817E+18,en,30,1,7,27,,,,SocialFlow,"A leading scientist tracking the deadly coronavirus outbreak shot down rumours about its origins, saying there was ‘no evidence whatsoever of genetic engineering’ https://t.co/r3popWU8wP"
1197,4898091,2020-02-14 05:20:07+00:00, ,1.22819E+18,en,45,3,5,37,,,,SocialFlow,"US prosecutors have accused Huawei of stealing technology from six companies in a ‘pattern of racketeering’, as well as violating sanctions against North Korea and making false statements to the FBI https://t.co/mhh5n0LH3I"
1196,4898091,2020-02-14 05:40:01+00:00, ,1.22819E+18,en,16,1,0,19,,,,SocialFlow,"Investors poured $23.6bn into fixed-income funds over the week ending Wednesday, the biggest weekly intake since 2001, as coronavirus raised fears of a global growth slowdown https://t.co/MagJrjY7Wm"
1195,4898091,2020-02-14 06:00:12+00:00, ,1.2282E+18,en,132,33,8,162,,,,SocialFlow,"FT Exclusive: Amazon is offering free shipping to Israeli settlements in the occupied West Bank, but only to their Palestinian neighbours if they list their country as Israel, an FT investigation has found https://t.co/bVoxMakDfr https://t.co/PikM4ZOfLj"
1193,4898091,2020-02-14 06:40:05+00:00, ,1.22821E+18,en,24,0,1,16,,,,SocialFlow,"Airbus is preparing to launch a new, greener aircraft as early as 2025 to meet tough emissions targets, chief executive Guillaume Faury told the FT https://t.co/Cza1Cj4WtJ"
1190,4898091,2020-02-14 07:30:05+00:00, ,1.22822E+18,en,12,1,1,9,,,,SocialFlow,Sajid Javid is the first chancellor in 50 years not to deliver a Budget. Here’s what to expect as the dust settles https://t.co/G35Hm3ZH41
1189,4898091,2020-02-14 07:44:24+00:00, ,1.22822E+18,en,0,0,0,573,,,,SocialFlow,RT @HenryJFoy: Scoop! - US authorities reveal why they sanctioned Oleg Deripaska: because they have reports that he laundered money and hel…
1188,4898091,2020-02-14 07:45:03+00:00, ,1.22822E+18,en,17,0,0,4,,,,SocialFlow,A growing number of companies understand that crisis planning is vital. But small companies are often focused only on day-to-day operations https://t.co/7jmyhC3RXn https://t.co/JiQlb5xBSq
1187,4898091,2020-02-14 08:00:10+00:00, ,1.22823E+18,en,31,8,1,26,,,,SocialFlow,"China has said 1,716 doctors have come down with coronavirus, underscoring the significant toll taken by front-line medical professionals. Follow our live coverage here: https://t.co/ebJQw3zzb4 https://t.co/dUx0sP1ExH"
1185,4898091,2020-02-14 08:30:07+00:00, ,1.22823E+18,en,5,1,2,2,,,,SocialFlow,The FT reports from inside the courtroom of the frequently devastating and always gripping case that will define the #MeToo era: The People v Harvey Weinstein https://t.co/uHTaBRZ676
1184,4898091,2020-02-14 08:45:07+00:00, ,1.22824E+18,en,28,1,2,21,,,,SocialFlow,"In April 2015, while sailing around the Caribbean, Jes Staley dropped anchor at Little St James, the private island owned by Jeffrey Epstein. Their relationship is now at the centre of a regulatory investigation https://t.co/3AysqA49VN"
1183,4898091,2020-02-14 09:00:05+00:00, ,1.22824E+18,en,31,3,3,12,,,,SocialFlow,Rishi Sunak is the first millennial to occupy one of the great offices of state as chancellor of the exchequer. His appointment is a big gamble: the 39-year-old has only weeks to pull together Boris Johnson’s first Budget https://t.co/gZ82SRBo9p
1182,4898091,2020-02-14 09:20:06+00:00, ,1.22825E+18,en,17,3,1,5,,,,SocialFlow,"Amid the deluge of selfies, Instagram ‘content creators’ are bringing financial education into the social media mainstream, providing ‘inspo’ for those looking to learn to budget, start a retirement fund or get out of debt https://t.co/UBxiyAPx1G"
1181,4898091,2020-02-14 09:40:04+00:00, ,1.22825E+18,en,6,1,0,8,,,,SocialFlow,"Iran once sought to win hearts and minds with street posters of martyrs and speeches by clerics. Now the regime is putting its money into reality shows, comedies, documentaries and feature length films https://t.co/ajaaW4eddI"
1175,4898091,2020-02-14 10:14:00+00:00, ,1.22826E+18,en,325,14,21,68,,,,Ads Uploader for Twitter,"""It turns out that real life is not, in fact, a montage of inspirational quotes that we should live by; and getting ahead doesn’t always mean searching for more 'grit'"". https://t.co/bUg0LgpmD3"
1173,4898091,2020-02-14 10:14:01+00:00, ,1.22826E+18,en,263,3,11,33,,,,Ads Uploader for Twitter,"""It turns out that real life is not, in fact, a montage of inspirational quotes that we should live by; and getting ahead doesn’t always mean searching for more 'grit'"". https://t.co/Bi982VnoDC"
1171,4898091,2020-02-14 10:14:02+00:00, ,1.22826E+18,en,257,7,11,34,,,,Ads Uploader for Twitter,"""It turns out that real life is not, in fact, a montage of inspirational quotes that we should live by; and getting ahead doesn’t always mean searching for more 'grit'"". https://t.co/0MGvx3ONq8"
1170,4898091,2020-02-14 10:14:02+00:00, ,1.22826E+18,en,4,0,0,1,,,,Ads Uploader for Twitter,"""There are important upsides to the proliferation of social media in China. At the same time, however, receiving information straight to your phone, in real time, can make you feel like the virus is closing in on you — even if it’s not."" https://t.co/px3DCiF3R6"
1172,4898091,2020-02-14 10:14:02+00:00, ,1.22826E+18,en,0,0,0,0,,,,Ads Uploader for Twitter,"""There are important upsides to the proliferation of social media in China. At the same time, however, receiving information straight to your phone, in real time, can make you feel like the virus is closing in on you — even if it’s not."" https://t.co/UPBM7s8k7y"
1169,4898091,2020-02-14 10:14:03+00:00, ,1.22826E+18,en,202,12,4,70,,,,Ads Uploader for Twitter,"""It turns out that real life is not, in fact, a montage of inspirational quotes that we should live by; and getting ahead doesn’t always mean searching for more 'grit'"". https://t.co/6C3CqnuUoa"
1168,4898091,2020-02-14 10:14:03+00:00, ,1.22826E+18,en,12,1,2,6,,,,Ads Uploader for Twitter,"""There are important upsides to the proliferation of social media in China. At the same time, however, receiving information straight to your phone, in real time, can make you feel like the virus is closing in on you — even if it’s not."" https://t.co/RF01W3qAgi"
1167,4898091,2020-02-14 10:14:04+00:00, ,1.22826E+18,en,107,4,2,47,,,,Ads Uploader for Twitter,"""It turns out that real life is not, in fact, a montage of inspirational quotes that we should live by; and getting ahead doesn’t always mean searching for more 'grit'"". https://t.co/Ud2rYKaHcu"
1166,4898091,2020-02-14 10:14:04+00:00, ,1.22826E+18,en,58,1,3,27,,,,Ads Uploader for Twitter,"""There are important upsides to the proliferation of social media in China. At the same time, however, receiving information straight to your phone, in real time, can make you feel like the virus is closing in on you — even if it’s not."" https://t.co/FVrGSqiZnK"
1165,4898091,2020-02-14 10:14:05+00:00, ,1.22826E+18,en,379,27,2,125,,,,Ads Uploader for Twitter,"""It turns out that real life is not, in fact, a montage of inspirational quotes that we should live by; and getting ahead doesn’t always mean searching for more 'grit'"". https://t.co/AxYoZeaydk"
1159,4898091,2020-02-14 10:14:07+00:00, ,1.22826E+18,en,138,4,6,15,,,,Ads Uploader for Twitter,"""It turns out that real life is not, in fact, a montage of inspirational quotes that we should live by; and getting ahead doesn’t always mean searching for more 'grit'"". https://t.co/Z5km3EfVsF"
1160,4898091,2020-02-14 10:14:07+00:00, ,1.22826E+18,en,21,1,3,9,,,,Ads Uploader for Twitter,"""Fewer voters are willing to hold on to their tribal allegiances in a world where political promises have been badly devalued."" https://t.co/wpHMlyhwsh"
1158,4898091,2020-02-14 10:14:08+00:00, ,1.22826E+18,en,3,0,0,1,,,,Ads Uploader for Twitter,"""Fewer voters are willing to hold on to their tribal allegiances in a world where political promises have been badly devalued."" https://t.co/n7trMciIrL"
1154,4898091,2020-02-14 10:14:09+00:00, ,1.22826E+18,en,16,0,1,2,,,,Ads Uploader for Twitter,"""Ever since the American republic was created, the system for setting borders has been controversial and prone to manipulation."" https://t.co/Qs1bSa8aqb"
1150,4898091,2020-02-14 10:14:11+00:00, ,1.22826E+18,en,10,0,0,3,,,,Ads Uploader for Twitter,"""Ever since the American republic was created, the system for setting borders has been controversial and prone to manipulation."" https://t.co/Yi9WpgyCas"
1148,4898091,2020-02-14 10:14:12+00:00, ,1.22826E+18,en,4,0,0,0,,,,Ads Uploader for Twitter,"""Ever since the American republic was created, the system for setting borders has been controversial and prone to manipulation."" https://t.co/IMn46rjVAm"
1147,4898091,2020-02-14 10:14:12+00:00, ,1.22826E+18,en,4,0,0,1,,,,Ads Uploader for Twitter,"""There are important upsides to the proliferation of social media in China. At the same time, however, receiving information straight to your phone, in real time, can make you feel like the virus is closing in on you — even if it’s not."" https://t.co/zmiGH9MnkJ"
1146,4898091,2020-02-14 10:14:13+00:00, ,1.22826E+18,en,1,0,0,1,,,,Ads Uploader for Twitter,"""Ever since the American republic was created, the system for setting borders has been controversial and prone to manipulation."" https://t.co/AJJHN5gy8E"
1141,4898091,2020-02-14 11:40:04+00:00, ,1.22828E+18,en,15,0,3,13,,,,SocialFlow,Sajid Javid has become the first chancellor in 50 years not to deliver a Budget. So what happens now? https://t.co/gg0ZqnecaH
1138,4898091,2020-02-14 12:40:03+00:00, ,1.2283E+18,en,6,3,2,4,,,,SocialFlow,"Benjamin Griveaux, French President Emmanuel Macron’s choice for Paris mayor in next month’s local elections, has withdrawn as a candidate after an explicit video and some of his private messages appeared online https://t.co/Lg6GzrPn9E"
1137,4898091,2020-02-14 13:00:13+00:00, ,1.2283E+18,en,8,0,1,10,,,,SocialFlow,Good morning New York. While you were sleeping this was our most-read story https://t.co/V3QUVgcgT3
1135,4898091,2020-02-14 13:40:04+00:00, ,1.22831E+18,en,5,0,1,4,,,,SocialFlow,"Some CDU members insist the ban on working with the far right must stay. Others say the AfD’s rising support requires a different approach
https://t.co/xeop6omtDt"
1134,4898091,2020-02-14 14:00:05+00:00, ,1.22832E+18,en,9,0,0,3,,,,SocialFlow,"France’s Vivendi dangled the possibility of taking its biggest business, Universal Music, public by 'early 2023 at the latest'
https://t.co/9IjzhxhhSf"
1132,4898091,2020-02-14 14:20:03+00:00, ,1.22832E+18,en,16,0,1,5,,,,SocialFlow,"Arrokoth is one of a vast population of asteroid-like bodies orbiting the sun in a distant region called the Kuiper Belt, far beyond Neptune
https://t.co/epUdDwjhDv"
1128,4898091,2020-02-14 15:39:04+00:00, ,1.22834E+18,en,8,0,1,4,,,,SocialFlow,Planning a trip to the cinema this week? Here's our guide to what to see https://t.co/RO3KIxBags
1127,4898091,2020-02-14 16:00:09+00:00, ,1.22835E+18,en,8,0,0,4,,,,SocialFlow,Coronavirus: Business continuity planning is a vital tool when a sudden crisis hits. https://t.co/UEszIY1csI https://t.co/cUcp9sabxQ
1120,4898091,2020-02-14 18:00:07+00:00, ,1.22838E+18,en,18,4,1,7,,,,SocialFlow,"When terrorism meets gaming: how video games, streaming platforms and gamification have become intertwined with Isis and the far right
https://t.co/boBXfzIAVn"
1119,4898091,2020-02-14 18:20:08+00:00, ,1.22838E+18,en,15,0,0,5,,,,SocialFlow,"What’s going on in the US economy? The FT's US finance editor, Robert Armstrong, explores what consumer and corporate borrowing means for the nation https://t.co/aYYHK8gKCG"
1117,4898091,2020-02-14 19:00:10+00:00, ,1.22839E+18,en,16,0,1,11,,,,SocialFlow,Edward Luce: I have little doubt that Trump will pardon Roger Stone whatever sentence he receives https://t.co/7wzN8ypZGR
1116,4898091,2020-02-14 19:20:04+00:00, ,1.2284E+18,en,12,1,2,3,,,,SocialFlow,"Only hours after his former Hollywood friends &amp; collaborators partied into the night following the Oscars, Harvey Weinstein was hobbling up the steps of a New York criminal court. @annaknicolaou goes inside the trial of the once all-powerful film producer https://t.co/tojlq68231"
1115,4898091,2020-02-14 19:40:03+00:00, ,1.2284E+18,en,552,28,51,471,,,,SocialFlow,"Nancy Pelosi has warned European countries they will ‘choose autocracy over democracy’ if they let Huawei take part in rolling out 5G technology, in a sign of the bipartisan US political pressure over the Chinese company https://t.co/OpcsG2k1Qc"
1113,4898091,2020-02-14 20:20:04+00:00, ,1.22841E+18,en,17,1,1,7,,,,SocialFlow,"The new coronavirus has driven demand for face masks up, but mask manufacturers — most of which are based in China — have struggled to keep pace. Here’s why https://t.co/sGea59FXjr"
1111,4898091,2020-02-14 21:00:06+00:00, ,1.22842E+18,en,13,0,1,9,,,,SocialFlow,How Instagram's online finance community is bringing financial education to the masses https://t.co/RTmqnOgRoF
1110,4898091,2020-02-14 21:15:07+00:00, ,1.22843E+18,en,16,8,0,17,,,,SocialFlow,"Just published: front page of FT Weekend, UK edition, Saturday 15 February         https://t.co/YAaHU8H59b https://t.co/J02DubDRmk"
1109,4898091,2020-02-14 21:20:07+00:00, ,1.22843E+18,en,15,0,1,9,,,,SocialFlow,"Airbus is preparing to launch a new, greener aircraft as early as 2025 to meet tough emissions targets, chief executive Guillaume Faury told the FT
https://t.co/GdfbCHPJal"
1108,4898091,2020-02-14 21:40:07+00:00, ,1.22843E+18,en,231,68,40,141,,,,SocialFlow,The UK is in talks with China about putting its troubled high-speed railway back on track after Beijing said it could build the line in only five years for less money and at a faster speed https://t.co/SHRlqip4CO
1106,4898091,2020-02-14 22:21:04+00:00, ,1.22844E+18,en,11,3,0,10,,,,SocialFlow,"Just published: front page of FT Weekend, international edition, Saturday 15 February         https://t.co/EYkAAailxj https://t.co/QKVMm1RDHi"
1104,4898091,2020-02-14 22:40:09+00:00, ,1.22845E+18,en,0,0,0,6,,,,SocialFlow,RT @jsphctrl: Ramaphosa promises a lot more independent power production for South Africa to break Eskom’s blackouts. But how much will get…
1102,4898091,2020-02-14 23:17:29+00:00, ,1.22846E+18,en,19,4,1,14,,,,SocialFlow,New York Chinatown business suffers from coronavirus fears https://t.co/jFXEFPWBPk
1099,4898091,2020-02-15 00:22:09+00:00, ,1.22847E+18,en,21,0,3,10,,,,SocialFlow,US and Taliban agree to reduce violence in step toward peace https://t.co/aF3tcxzks5
1098,4898091,2020-02-15 00:44:15+00:00, ,1.22848E+18,en,0,0,0,14,,,,SocialFlow,RT @MAmdorsky: Eurozone economy set for slowest growth in 7 years - quarterly GDP figures due today are set to show that growth has slowed…
1094,4898091,2020-02-15 03:33:43+00:00, ,1.22852E+18,en,7,0,0,3,,,,SocialFlow,Andrea Orcel suffers defeat in criminal complaint against Santander https://t.co/esZwFPt2Vp
1093,4898091,2020-02-15 05:16:52+00:00, ,1.22855E+18,en,18,1,2,11,,,,SocialFlow,Tel Aviv’s party people hail rollout of Sabbath bus service https://t.co/jNCxm3DNq3
1092,4898091,2020-02-15 06:06:03+00:00, ,1.22856E+18,en,12,0,3,3,,,,SocialFlow,'Freq­uently devastating but always gripping': @annaknicolaou reports from inside the Harvey Weinstein trial in New York City https://t.co/ULhqoW6EXy
1090,4898091,2020-02-15 08:04:04+00:00, ,1.22859E+18,en,21,0,0,4,,,,SocialFlow,"In 2007 he broke the auction record for a European artist, selling this painting for £5.7m. Peter Doig talks about his journey to becoming one of the most renowned painters in the world: https://t.co/DNcBKdybe4 https://t.co/k7ngL7wvrt"
1089,4898091,2020-02-15 09:00:08+00:00, ,1.2286E+18,en,7,0,0,3,,,,SocialFlow,"Pick up tips on how to handle a big interview with our new masterclass, led by the FT's chief features writer Henry Mance https://t.co/Lju1qEqaKD https://t.co/3HkfbW1SPs"
1085,4898091,2020-02-15 11:49:16+00:00, ,1.22865E+18,en,18,2,8,11,,,,SocialFlow,Joe Biden events leave New York donors with sinking feeling https://t.co/T1zPDiTRvj
1087,4898091,2020-02-15 11:49:16+00:00, ,1.22865E+18,en,9,0,0,3,,,,SocialFlow,Jupiter Fund Management in advanced talks to buy Merian Global Investors https://t.co/NYEPTTjFI4
1082,4898091,2020-02-15 12:25:50+00:00, ,1.22866E+18,en,31,2,0,36,,,,SocialFlow,France reports first coronavirus death outside Asia https://t.co/efXIz7LXa4
1080,4898091,2020-02-15 14:16:53+00:00, ,1.22868E+18,en,11,3,0,5,,,,SocialFlow,‘We want to finish this conflict’: Mali is ready to talk peace with jihadis https://t.co/2J9USIPkip
1077,4898091,2020-02-15 18:05:03+00:00, ,1.22874E+18,en,42,2,0,13,,,,SocialFlow,"If Mustique is too starry and Barbados too mass market then you might want to know about Bequia, the 'quiet island' with a sense of the old Caribbean https://t.co/67LSNf6avf"
1075,4898091,2020-02-15 19:09:03+00:00, ,1.22876E+18,en,21,8,11,16,,,,SocialFlow,Mark Zuckerberg admits Facebook was slow on Russian disinformation https://t.co/Y0skP4ifJG
1073,4898091,2020-02-15 22:02:08+00:00, ,1.2288E+18,en,24,1,0,15,,,,SocialFlow,"Every 50 years or so, a new technology comes along that revolutionises the home — and it is rarely the thing that advertisers spend their budgets trying to convince us it will be https://t.co/eR4JQmSlhQ"
1068,4898091,2020-02-16 05:07:03+00:00, ,1.22891E+18,en,10,1,1,13,,,,SocialFlow,‘It looks like judgment day’: inside Syria’s final battle https://t.co/1izfyrhCwK
1066,4898091,2020-02-16 05:38:51+00:00, ,1.22892E+18,en,34,7,6,9,,,,SocialFlow,Rory Stewart pledges to set up ‘City’ embassies in EU capitals https://t.co/mCLhCpa5dQ
1064,4898091,2020-02-16 07:04:04+00:00, ,1.22894E+18,en,23,0,0,10,,,,SocialFlow,How Anthony Vaccarello and Francesca Bellettini revived French fashion house Saint Laurent to take it past the €2bn turnover milestone for the first time https://t.co/xvrbwMQzWQ
1062,4898091,2020-02-16 08:32:03+00:00, ,1.22896E+18,en,40,1,3,27,,,,SocialFlow,Official account questions Xi Jinping coronavirus timeline https://t.co/G5ucujz9kj
1061,4898091,2020-02-16 09:00:11+00:00, ,1.22897E+18,en,15,0,0,2,,,,SocialFlow,Want to know how the FT produces award-winning long reads? Join two of our senior editors for this in-depth masterclass. Find out more here: https://t.co/NT6TjikFvJ
1059,4898091,2020-02-16 10:03:06+00:00, ,1.22898E+18,en,33,0,1,9,,,,SocialFlow,"In the cycle of fashion trends, five years can seem like a lifetime. So how has the Chanel jacket managed to remain a bestseller 60 years on from its creation? The @htsi team look at why this remains the ultimate investment piece https://t.co/VolObVe437"
1058,4898091,2020-02-16 10:05:26+00:00, ,1.22898E+18,en,14,0,2,3,,,,SocialFlow,Indian IT industry head accuses US of discrimination over worker visas https://t.co/qdNeIqoSOi
1056,4898091,2020-02-16 11:09:23+00:00, ,1.229E+18,en,5,1,1,3,,,,SocialFlow,Former MEP warns of fresh raid on fund managers’ EU business models https://t.co/bOJWfukE0p
1051,4898091,2020-02-16 13:03:54+00:00, ,1.22903E+18,en,17,1,4,11,,,,SocialFlow,Merkel’s successor must confront Germany’s decline https://t.co/S1DWC2fVVu
1046,4898091,2020-02-16 15:12:26+00:00, ,1.22906E+18,en,17,5,2,10,,,,SocialFlow,Digital tools can be a useful bolster to democracy https://t.co/l4rTBTyNlN
1034,4898091,2020-02-16 20:45:08+00:00, ,1.22914E+18,en,20,2,1,14,,,,SocialFlow,"Just published: front page of the Financial Times UK edition, Monday February 17 https://t.co/lYeQZkJ4qP https://t.co/uwZwY4hErh"
1033,4898091,2020-02-16 21:02:07+00:00, ,1.22915E+18,en,67,1,2,22,,,,SocialFlow,American photographer Dorothea Lange is best known for her Depression-era pictures but the archives of her life’s work reveal a very different artist https://t.co/sGO2U3gnOe https://t.co/GMH2bRFSaR
1031,4898091,2020-02-16 22:04:03+00:00, ,1.22916E+18,en,15,0,1,3,,,,SocialFlow,Joy Lo Dico: These books offer a rehearsal for a disaster. Would you turn on the aircon? https://t.co/r06Ed33o0c
1028,4898091,2020-02-17 01:00:11+00:00, ,1.22921E+18,en,57,5,3,34,,,,SocialFlow,Economists are becoming increasingly exercised about the problems that will inevitably surface when the next recession comes along https://t.co/bI7X9fSOwS
