,author id,created_at,geo,id,lang,like_count,quote_count,reply_count,retweet_count,positive SA value,Negative SA values,Compound,source,tweet
1663,4898091,2020-02-07 14:20:06+00:00, ,1.22579E+18,en,11,1,5,8,,,,SocialFlow,"Camilla Cavendish: COP26 should be an opportunity for post-Brexit Britain to enhance its global reputation. Instead, it has descended into petty squabbling 
https://t.co/VEmSz7cw9Y"
1660,4898091,2020-02-07 15:20:03+00:00, ,1.2258E+18,en,44,2,2,27,,,,SocialFlow,"Tom Mitchell: The death of Li Wenliang has triggered a nationwide howl and mourning that now threatens Chinese president Xi Jinping's belated attempt to get to grips with the coronavirus epidemic 
https://t.co/R3c73HoZwk"
1659,4898091,2020-02-07 15:40:06+00:00, ,1.22581E+18,en,21,5,1,12,,,,SocialFlow,"The FT View: Hell hath no fury like an acquitted Donald Trump
https://t.co/O5fS0kBoXh"
1656,4898091,2020-02-07 16:27:31+00:00, ,1.22582E+18,en,2,0,1,1,,,,Twitter Web App,"Not a single woman has been nominated for best director – and, five years after #OscarsSoWhite, just one performer of colour was named among 20 acting nominations.

That’s despite the actors we see on screen getting more diverse https://t.co/VY9uWEpqT6 https://t.co/XVPCxNjLUf"
1654,4898091,2020-02-07 16:27:32+00:00, ,1.22582E+18,en,0,0,1,1,,,,Twitter Web App,"Can the Oscars break the diversity deadlock? In the wake of #OscarsSoWhite, younger Academy members, women and filmmakers of colour were drafted in in an attempt to change the demographics of the overwhelmingly white and male voter pool https://t.co/VY9uWEpqT6 https://t.co/fFrVhpmeil"
1652,4898091,2020-02-07 16:27:33+00:00, ,1.22582E+18,en,7,1,1,7,,,,Twitter Web App,"Women account for 44% of mainstream film actors but just 26% of producers on Hollywood films, 16% of writers and 8% of directors https://t.co/JdAbZS8AON https://t.co/ohCGMZ4aRl"
1651,4898091,2020-02-07 16:27:34+00:00, ,1.22582E+18,en,4,0,1,4,,,,Twitter Web App,"Do the Oscars still matter today? Well, the less chance a film has to win awards, the less likely it is to get made — and that means the status quo in how films are made is also less likely to change. 

Tune in to our @FTCultureCall podcast to hear more https://t.co/PjDjWatzDv https://t.co/20s2cozDtL"
1647,4898091,2020-02-07 17:15:33+00:00, ,1.22583E+18,en,20,2,0,4,,,,Twitter for Advertisers.,"""Never in my life have I seen the Democratic party suffer a case of political amnesia this bad."" https://t.co/cTRmho1Fp8"
1644,4898091,2020-02-07 18:00:29+00:00, ,1.22584E+18,en,22,0,6,12,,,,SocialFlow,"Critics at home and abroad have slammed Indian prime minister Narendra Modi's government for prioritising social reengineering over economic growth
https://t.co/6mWz3oUhYe"
1642,4898091,2020-02-07 22:00:23+00:00, ,1.2259E+18,en,6,1,1,8,,,,SocialFlow,Just published: front page of the Financial Times international edition Saturday February 8 https://t.co/WQIfA7qr0g https://t.co/72EXlFWR6t
1640,4898091,2020-02-07 22:03:04+00:00, ,1.2259E+18,en,37,0,1,12,,,,SocialFlow,Looking for a new book? Here's our round-up of the best new releases https://t.co/1Tq8hzPy8G
1638,4898091,2020-02-07 23:22:09+00:00, ,1.22592E+18,en,14,1,3,9,,,,SocialFlow,Gloves come off as Democrats debate in New Hampshire https://t.co/raOXSdQ3CL
1636,4898091,2020-02-08 01:47:36+00:00, ,1.22596E+18,en,19,1,4,11,,,,SocialFlow,A second prominent witness has been fired in the aftermath of the US president’s acquittal on charges of abuse of power and obstruction. https://t.co/t0jdVaRyY5
1635,4898091,2020-02-08 02:06:53+00:00, ,1.22596E+18,en,16,0,2,6,,,,SocialFlow,"Pete Buttigieg has come under heavy attack on the Democratic presidential debate stage, as the other contenders took aim at the former mayor of South Bend after his narrow victory in the Iowa caucuses https://t.co/da9XH61iNc"
1634,4898091,2020-02-08 04:03:01+00:00, ,1.22599E+18,en,16,1,2,6,,,,SocialFlow,Enjoy two bakes in one bite with Honey &amp; Co’s dark and white chocolate marble cake https://t.co/G7DM8Kgfq1
1632,4898091,2020-02-08 05:19:00+00:00, ,1.22601E+18,en,5,0,4,2,,,,SocialFlow,The Oscars diversity problem in charts https://t.co/VR1E1WvlK6
1630,4898091,2020-02-08 05:19:00+00:00, ,1.22601E+18,en,16,0,1,8,,,,SocialFlow,Coronavirus outbreak weighs heavily on global economy https://t.co/upzqjZT1o6
1629,4898091,2020-02-08 06:04:01+00:00, ,1.22602E+18,en,32,2,3,20,,,,SocialFlow,Find out why big investors are buying up trailer parks in the US (and why 22 million Americans are living in them) https://t.co/NatJcg7i0j
1628,4898091,2020-02-08 10:11:36+00:00, ,1.22609E+18,en,8,0,0,14,,,,SocialFlow,Mapping the coronavirus outbreak https://t.co/WVmUN3XBsL
1625,4898091,2020-02-08 12:04:06+00:00, ,1.22611E+18,en,26,2,4,18,,,,SocialFlow,Eric Li's repackaging the Chinese government's party line for the age of TED talks and social media. But how convincing is he? https://t.co/hEUd56BLoT
1622,4898091,2020-02-08 16:03:06+00:00, ,1.22617E+18,en,11,4,4,1,,,,SocialFlow,"Right now, Hollywood is gearing up to host the Oscars this weekend. But to many people, the 2020 Academy Awards were ruined from the moment of the nominations on January 13 https://t.co/6blKLMzRCe"
1618,4898091,2020-02-08 23:22:06+00:00, ,1.22629E+18,en,26,1,2,12,,,,SocialFlow,"Ireland election is three-way tie, says exit poll https://t.co/HrWLbe5jhy"
1617,4898091,2020-02-09 01:05:06+00:00, ,1.22631E+18,en,17,1,1,12,,,,SocialFlow,"With few survivors of the Holocaust still alive today, time is running out to bring the remaining perpetrators to justice. We go inside what could be one of the last trials of a Nazi concentration camp guard https://t.co/NsZMVAN7Lr https://t.co/15E17OMmqR"
1616,4898091,2020-02-09 01:43:34+00:00, ,1.22632E+18,en,16,1,1,13,,,,SocialFlow,Coronavirus scare prompts North Korean crackdown on trade and travel https://t.co/QdQlzCBmhS
1615,4898091,2020-02-09 03:09:09+00:00, ,1.22634E+18,en,12,1,2,7,,,,SocialFlow,Our wine critic @JancisRobinson thinks she might have found the best Bordeaux she’ll ever taste. And it’s this one: https://t.co/muwWSfBnoB
1614,4898091,2020-02-09 04:05:37+00:00, ,1.22636E+18,en,49,1,2,18,,,,SocialFlow,"From Japan to Norway, a new generation embraces the kimono https://t.co/A93ZpkZAfC"
1613,4898091,2020-02-09 05:05:57+00:00, ,1.22637E+18,en,42,2,1,14,,,,SocialFlow,"Work at home if you can, but don’t expect it to be paradise https://t.co/YdVs7AC5m5"
1609,4898091,2020-02-09 05:24:12+00:00, ,1.22638E+18,en,13,0,1,8,,,,SocialFlow,UK envoys ‘cannot do jobs’ as Trump leak inquiry drags on https://t.co/XoZ10Qmc3i
1610,4898091,2020-02-09 05:24:12+00:00, ,1.22638E+18,en,22,0,0,15,,,,SocialFlow,Hong Kong turmoil triggers Singapore fund licence surge https://t.co/2ncjAduqBo
1607,4898091,2020-02-09 07:16:24+00:00, ,1.2264E+18,en,20,2,3,21,,,,SocialFlow,Coronavirus death toll tops Sars as Beijing faces public backlash https://t.co/kdqZV78JNX
1605,4898091,2020-02-09 09:23:09+00:00, ,1.22644E+18,en,26,3,1,13,,,,SocialFlow,"Spain will consult business on labour law, says economy chief https://t.co/kTbhBpco5t"
1602,4898091,2020-02-09 10:58:27+00:00, ,1.22646E+18,en,9,1,2,3,,,,SocialFlow,Soldier kills 26 people in Thailand shooting rampage https://t.co/eZgJO8KTN4
1600,4898091,2020-02-09 11:37:06+00:00, ,1.22647E+18,en,10,2,0,1,,,,SocialFlow,Payments groups join forces to survive https://t.co/wBZZNIumNy
1599,4898091,2020-02-09 11:37:06+00:00, ,1.22647E+18,en,5,0,3,5,,,,SocialFlow,Hollywood blockbusters break into India https://t.co/GWThGtr2o1
1598,4898091,2020-02-09 12:09:33+00:00, ,1.22648E+18,en,19,3,0,9,,,,SocialFlow,The Federal Reserve’s new inflation regime https://t.co/FzqQJ6Rwws
1597,4898091,2020-02-09 12:51:14+00:00, ,1.22649E+18,en,40,6,5,21,,,,SocialFlow,"In Poland, the rule of law is under ever greater threat https://t.co/7k1g17Zuw4"
1593,4898091,2020-02-09 15:24:18+00:00, ,1.22653E+18,en,8,0,0,5,,,,SocialFlow,France’s Covéa in talks to buy Agnelli-owned PartnerRe for $9bn https://t.co/RJ858iBYeo
1592,4898091,2020-02-09 17:01:03+00:00, ,1.22655E+18,en,20,0,0,3,,,,SocialFlow,"'The greatest art must be harnessed to human experience, as it is actually lived, to have the greatest effect on us' https://t.co/Siao9mwm60"
1590,4898091,2020-02-09 18:47:05+00:00, ,1.22658E+18,en,12,0,2,11,,,,SocialFlow,Sinn Féin demands government role after Irish poll breakthrough https://t.co/THS3omLLC8
1588,4898091,2020-02-09 18:47:06+00:00, ,1.22658E+18,en,16,2,0,15,,,,SocialFlow,China seeks to restart economy despite coronavirus outbreak https://t.co/FFKkKblWE5
1587,4898091,2020-02-09 19:10:07+00:00, ,1.22658E+18,en,14,0,0,4,,,,SocialFlow,"Noah Baumbach: 'It's by throwing an egg on the floor and seeing what’s inside that I could find ways to actually talk about the relationship... and also tell a kind of love story'

On @FTCultureCall this week we talk to the director of Marriage Story: https://t.co/OjHtJJH2l1 https://t.co/wu686ysVVY"
1586,4898091,2020-02-09 19:32:28+00:00, ,1.22659E+18,en,16,0,0,7,,,,SocialFlow,Alphabet’s X looks beyond Silicon Valley for next big idea https://t.co/jBBtnL7rax
1585,4898091,2020-02-09 21:12:09+00:00, ,1.22661E+18,en,38,2,4,11,,,,SocialFlow,"Opinion: Pro-Europeanism is now a visceral part of a significant portion of the country’s political identity. It is as emotional for them as it was for the Brexiters, says Robert Shrimsley https://t.co/RtNFh6wGBl"
1583,4898091,2020-02-09 21:21:37+00:00, ,1.22662E+18,en,31,3,5,5,,,,SocialFlow,Bernie Sanders keeps his grip on the hearts of young Democrats https://t.co/2Sdzpguwww
1581,4898091,2020-02-09 21:50:11+00:00, ,1.22662E+18,en,27,1,2,14,,,,SocialFlow,Just published: front page of the Financial Times UK edition Monday February 10 https://t.co/XE14oonp6s https://t.co/mUBSSClJur
1578,4898091,2020-02-10 00:00:04+00:00, ,1.22666E+18,en,11,0,1,7,,,,SocialFlow,"Good morning, Hong Kong. While you were sleeping, this was our most read story; https://t.co/AC9OFy4bq4"
1576,4898091,2020-02-10 01:01:32+00:00, ,1.22667E+18,en,12,0,0,8,,,,SocialFlow,Puerto Rico says deal with bondholders will cut debt by $24bn https://t.co/0Atqd9c0QV
1571,4898091,2020-02-10 04:00:14+00:00, ,1.22672E+18,en,4,0,0,1,,,,SocialFlow,"From an analysis on the pitfalls and allure of drinking to tips to having a happier and healthier life, here is a selection of our best weekend reads: https://t.co/RymyXa79ps"
1570,4898091,2020-02-10 04:20:04+00:00, ,1.22672E+18,en,9,0,0,4,,,,SocialFlow,"When Salia Yang last spoke with her mother, the latter was lying in hospital in Wuhan. They were brainstorming how to get her parents — Salia’s grandparents — admitted to hospital https://t.co/P3VSxF7YQN"
1569,4898091,2020-02-10 04:40:05+00:00, ,1.22673E+18,en,11,3,0,6,,,,SocialFlow,Brussels is expected this week to move towards stripping Cambodia of some trade preferences in response to a political crackdown against the country’s opposition https://t.co/KJcxKviWEA
1565,4898091,2020-02-10 05:17:47+00:00, ,1.22674E+18,en,14,0,0,5,,,,SocialFlow,Starling raises £60m to fund business service and overseas push https://t.co/01oBp0MRPl
1564,4898091,2020-02-10 05:17:48+00:00, ,1.22674E+18,en,11,3,0,6,,,,SocialFlow,Can Britain’s car plants stay open after Brexit? https://t.co/YXHJqWER4A
1562,4898091,2020-02-10 05:40:06+00:00, ,1.22674E+18,en,24,1,1,12,,,,SocialFlow,"Fine Gael and Fianna Fáil, Ireland’s main parties, have excluded Sinn Féin from the government because of its IRA links and leftist policies. But after Saturday's seismic election, that stance may be unsustainable. https://t.co/sjLX28BVNS"
1560,4898091,2020-02-10 06:00:09+00:00, ,1.22675E+18,en,16,1,0,6,,,,SocialFlow,"Luke Ellis, chief executive of the world’s largest publicly traded hedge fund manager, says the industry is changing — and star traders earning eye-watering pay packets no longer have a place https://t.co/auYbXBQztx https://t.co/E5mxsPFORE"
1559,4898091,2020-02-10 06:15:06+00:00, ,1.22675E+18,en,105,1,0,38,,,,SocialFlow,"In more than nine decades of the Academy Awards, no film in a language other than English has won the Best Picture prize. Thanks to ‘Parasite’, that’s no longer the case https://t.co/rT7VXWN4oR"
1556,4898091,2020-02-10 07:00:06+00:00, ,1.22676E+18,en,16,0,0,12,,,,SocialFlow,"Good morning, London. While you were sleeping, this was our most read story: https://t.co/bZez788seI"
1555,4898091,2020-02-10 07:15:03+00:00, ,1.22677E+18,en,28,1,3,10,,,,SocialFlow,"After months of deliberation, Boris Johnson is expected to give the go-ahead on Tuesday for the first phase of Britain’s HS2 high speed rail https://t.co/56ETjmb9O3"
1553,4898091,2020-02-10 07:30:04+00:00, ,1.22677E+18,en,0,0,0,12,,,,SocialFlow,RT @JavierespFT: A coalition of Google rivals has accused the search giant of competition abuse in holiday rentals in a letter sent to @ves…
1552,4898091,2020-02-10 07:45:03+00:00, ,1.22677E+18,en,17,0,2,10,,,,SocialFlow,"The UK held a second evacuation of British families from Wuhan, while China’s efforts to revive its economy fell short on Monday as markets across the region sank. Follow our live coverage here: https://t.co/xTdKt9zGOh"
1551,4898091,2020-02-10 08:00:07+00:00, ,1.22678E+18,en,16,0,1,4,,,,SocialFlow,The London Overground’s success has made it a possible model for a promised overhaul of the UK’s privatised railway franchising system https://t.co/aZB3PMhRAa
1545,4898091,2020-02-10 09:20:05+00:00, ,1.2268E+18,en,22,0,0,16,,,,SocialFlow,"China’s biggest tech company did not make any publicly disclosed investments in the US last year, as hostility brewed between Washington and Beijing https://t.co/uWTyyNykQu"
1543,4898091,2020-02-10 10:00:09+00:00, ,1.22681E+18,en,15,0,0,5,,,,SocialFlow,"Here's another chance to read our ★★★★★ review of Parasite, which last night won Best Picture at the Oscars, as well as Best Director for Bong Joon Ho https://t.co/jJgQJRt1Kh"
1541,4898091,2020-02-10 10:40:04+00:00, ,1.22682E+18,en,13,4,2,10,,,,SocialFlow,Sinn Féin has demanded a role in Ireland’s new government after surging to the highest vote share in a seismic general election that will make it hard for the country’s traditional ruling parties to govern without it https://t.co/TJvdQdSzPZ
1539,4898091,2020-02-10 11:20:05+00:00, ,1.22683E+18,en,22,1,0,12,,,,SocialFlow,"'I didn’t realise they would just die like that, so quickly and so easily,' said the 27-year-old Ms Yang, overcome with shock from the sudden deaths of her mother and grandfather https://t.co/0cCceeaCHs"
1536,4898091,2020-02-10 12:20:05+00:00, ,1.22684E+18,en,16,2,2,12,,,,SocialFlow,"Hollywood's diversity problem goes beyond Oscars — and when studios take the issue seriously, their films see a boost at the box office.  

Here's how the Academy Awards fail to reflect the gender and racial balance of the US population — in charts https://t.co/hJFqYy0SKC https://t.co/U9C4IgCIOh"
1533,4898091,2020-02-10 13:20:01+00:00, ,1.22686E+18,en,44,5,10,25,,,,SocialFlow,"‘After I wake up it is coffee, cigarettes and Netflix. My parents are not angry at me because they know how difficult it is.’ These are the stories behind the headlines of the Middle East’s struggling youth: https://t.co/VjNZJXLdfU"
1531,4898091,2020-02-10 13:40:05+00:00, ,1.22686E+18,en,21,2,1,6,,,,SocialFlow,"Ben Hall: With Sinn Féin’s stunning breakthrough in this weekend’s general election, Ireland’s century-long governing duopoly appears to be over https://t.co/QvTMYQI6kL"
1527,4898091,2020-02-10 14:20:07+00:00, ,1.22687E+18,en,59,11,82,23,,,,SocialFlow,"Jim Messina: The re-election of Donald Trump would pose an existential threat to the US and the world
https://t.co/AsNHP7ndbt"
1523,4898091,2020-02-10 15:40:04+00:00, ,1.22689E+18,en,8,1,1,2,,,,SocialFlow,"Tony Barber: Annegret Kramp-Karrenbauer committed public relations and policy blunders that damaged her standing with German voters
https://t.co/cdV8KHdp4l"
1521,4898091,2020-02-10 16:00:10+00:00, ,1.2269E+18,en,4,1,1,1,,,,SocialFlow,"Is there anything that can stop the viral video juggernaut TikTok? 
https://t.co/EWq9ylDGw9"
1520,4898091,2020-02-10 16:13:07+00:00, ,1.2269E+18,en,3,0,1,0,,,,Twitter for Advertisers.,“This is how Donald Trump stays president for four more years” https://t.co/bQikGQ0wjv
1519,4898091,2020-02-10 16:20:03+00:00, ,1.2269E+18,en,10,0,1,1,,,,SocialFlow,"Henry Mance: The good news is that big banks are cracking down on theft. The bad news is that they are starting in the office canteen
https://t.co/9FlIedRM32"
1517,4898091,2020-02-10 16:40:08+00:00, ,1.22691E+18,en,5,1,0,3,,,,SocialFlow,Leadership lessons: The onetime Parisian street fighter who delivered AstraZeneca's research-led renaissance https://t.co/as3OUedvEi
1515,4898091,2020-02-10 17:20:07+00:00, ,1.22692E+18,en,0,0,0,66,,,,SocialFlow,RT @laurapitel: Turkey tightened restrictions on the lira last night after a wobble that saw it slide past 6TL/$ last week. It’s the latest…
1514,4898091,2020-02-10 17:40:04+00:00, ,1.22692E+18,en,19,2,2,7,,,,SocialFlow,"'I didn’t realise they would just die like that, so quickly and so easily,' said the 27-year-old Ms Yang, overcome with shock from the sudden deaths of her mother and grandfather https://t.co/XHMF7MM01z"
1512,4898091,2020-02-10 18:20:06+00:00, ,1.22693E+18,en,0,0,0,33,,,,SocialFlow,RT @andrewtghill: Insights from inside: most white-collar criminals “sleepwalk over ethical lines” and it can happen to anyone. A former Mc…
1511,4898091,2020-02-10 18:40:06+00:00, ,1.22694E+18,en,17,1,0,10,,,,SocialFlow,Sinn Féin has emerged as Ireland’s biggest political force as the nationalist party delivered a historic breakthrough after decades on the fringes. The result caught a lot of people off guard — so we decided to explain what's driving its momentum https://t.co/dcbDyxu8wr
1510,4898091,2020-02-10 19:00:10+00:00, ,1.22694E+18,en,21,1,3,1,,,,SocialFlow,Rana Foroohar: What would happen to markets if Bernie Sanders continued to surge? https://t.co/aXVtkxQgBn
1508,4898091,2020-02-10 19:40:10+00:00, ,1.22695E+18,en,22,4,4,18,,,,SocialFlow,"Donald Trump has released his annual budget proposal, calling for a $4.6tn cut to projected spending over the next decade. The plan would invest in defence and infrastructure while cutting back on healthcare, disability benefits and student loan spending https://t.co/7PMoQWGdsz"
1507,4898091,2020-02-10 20:00:20+00:00, ,1.22696E+18,en,14,0,0,5,,,,SocialFlow,The New Hampshire primaries are tomorrow — and Democrats have been competing over independent voters. Pete Buttigieg and Amy Klobuchar are among the moderate candidates positioning themselves as centrist alternatives to democratic socialist Bernie Sanders https://t.co/p1LSR8Xpqy
1498,4898091,2020-02-10 22:20:03+00:00, ,1.22699E+18,en,16,4,0,7,,,,SocialFlow,"Officials are debating whether to open an office in Manchester in an effort to build a consensus of support around Boris Johnson’s new 'Global Britain' agenda
https://t.co/b1DyjyMQYT"
1497,4898091,2020-02-10 22:40:05+00:00, ,1.227E+18,en,0,0,0,1,,,,SocialFlow,RT @NikiBlasina: Our globetrotting head of luxury advertising has made New York her go-to city to reset with a detox — and returns feeling…
1496,4898091,2020-02-10 23:00:10+00:00, ,1.227E+18,en,5,1,0,2,,,,SocialFlow,"Rana Foroohar: Traditional metrics, such as unemployment, fail to capture what is really happening on the ground. This is especially true in the US https://t.co/53BjmwIuwD"
1495,4898091,2020-02-10 23:20:05+00:00, ,1.22701E+18,en,11,0,5,2,,,,SocialFlow,"'While there are clearly benefits of meeting people face to face to build relationships and gain insights into their culture, do you have to travel every time?' https://t.co/Vz73q8muTT @JonathanPBlack #businesstravel"
1492,4898091,2020-02-10 23:40:05+00:00, ,1.22701E+18,en,7,0,1,5,,,,SocialFlow,"A course to help people start new churches, or revive dwindling ones, draws on corporate techniques as it mirrors the way people in workplaces get new projects under way. https://t.co/OMcRq7xYpp @Jonathan_Moules #management"
1491,4898091,2020-02-10 23:40:15+00:00, ,1.22701E+18,en,11,1,0,7,,,,SocialFlow,Uber fails to block California gig economy law https://t.co/88PzUAwJam
1486,4898091,2020-02-11 01:52:57+00:00, ,1.22705E+18,en,11,0,1,6,,,,SocialFlow,Coronavirus threatens Australia’s record run of economic growth https://t.co/95KkA7U1gH
1485,4898091,2020-02-11 01:59:58+00:00, ,1.22705E+18,en,6,0,0,2,,,,SocialFlow,Google’s head of human resources to step down https://t.co/Yz075rxyfQ
1482,4898091,2020-02-11 03:35:50+00:00, ,1.22707E+18,en,18,2,5,14,,,,SocialFlow,"China’s Communist party has removed top health officials in Hubei, the province at the centre of the coronavirus outbreak, as the death toll topped 1,000. Follow our live coverage here: https://t.co/lNjErxkW2W"
1480,4898091,2020-02-11 04:20:05+00:00, ,1.22708E+18,en,7,1,0,5,,,,SocialFlow,News that a judge is set to approve T-Mobile USA’s $59bn takeover sent Sprint shares surging almost 70% in after-hours trading on Monday https://t.co/UojeflMrJD
1479,4898091,2020-02-11 04:40:06+00:00, ,1.22709E+18,en,9,0,0,12,,,,SocialFlow,"Amy Kazmin: School theatre may be momentous in the lives of young performers, but they are rarely the stuff of news headlines. Yet in India, a student play has landed the headteacher and a parent in jail for sedition https://t.co/yuPUMVWugn"
1477,4898091,2020-02-11 05:20:03+00:00, ,1.2271E+18,en,31,1,4,16,,,,SocialFlow,"Jamil Anderlini: Xi Jinping has studiously avoided mention of China’s dynastic cycle and the mandate of heaven, especially as traditional omens of collapse have piled up over the past year https://t.co/UH1cwdeln1"
1476,4898091,2020-02-11 05:40:05+00:00, ,1.22711E+18,en,16,2,2,13,,,,SocialFlow,Australia’s nearly three-decade run of economic growth could be broken as the coronavirus outbreak shuts swaths of the Chinese economy and Australia suffers its own wildfires crisis https://t.co/HRfRjC2vTi
1475,4898091,2020-02-11 06:00:04+00:00, ,1.22711E+18,en,10,2,0,2,,,,SocialFlow,"The job of a red-carpet stylist has become exponentially more difficult: Oscar attendees now aim to look refined as well as make a statement about inclusivity, ethics or sustainability https://t.co/TI0rejfQuk"
1473,4898091,2020-02-11 06:40:07+00:00, ,1.22712E+18,en,17,0,0,16,,,,SocialFlow,China’s biggest military technology company has set up a national laboratory for advanced technologies such as crime prediction and emotion recognition. It has also given a first wave of grants — including one in the UK https://t.co/Mm09hmOGUp
1472,4898091,2020-02-11 07:00:08+00:00, ,1.22713E+18,en,27,2,1,12,,,,SocialFlow,"Good morning, London. While you were sleeping, this was our most read story: https://t.co/Lkbj6g1dc7"
1471,4898091,2020-02-11 07:15:05+00:00, ,1.22713E+18,en,17,1,3,12,,,,SocialFlow,The UK’s demands to preserve the City of London’s access to European markets after Brexit appear intended to assuage fears that financial services could be left in the lurch  https://t.co/pUjttMNxry
1470,4898091,2020-02-11 07:22:55+00:00, ,1.22713E+18,en,0,0,0,11,,,,SocialFlow,"RT @adamsamson: Searches for 'coronavirus' appear to have peaked, Goldman points out. Here's what the Google Trends data look like https://…"
1467,4898091,2020-02-11 08:00:14+00:00, ,1.22714E+18,en,32,5,3,27,,,,SocialFlow,"New regulations in the UK will allow the government to quarantine people in England against their will, if necessary, to prevent the spread of the coronavirus https://t.co/Vd8rdiNjup"
1463,4898091,2020-02-11 09:00:16+00:00, ,1.22716E+18,en,10,1,1,4,,,,SocialFlow,"Fund managers are hoping that a hybrid approach, combining the judgment of a stockpicker with big data insights, will give them a new lease of life https://t.co/O9IlB0hXeK"
1458,4898091,2020-02-11 10:40:08+00:00, ,1.22718E+18,en,35,6,9,10,,,,SocialFlow,"The British government is demanding the EU sign up to a 'permanent equivalence' regime for financial services that will last for 'decades to come', to ensure the City of London can maintain access to the European market after Brexit https://t.co/OguqborNkO"
1457,4898091,2020-02-11 11:00:13+00:00, ,1.22719E+18,en,9,0,1,8,,,,SocialFlow,"The death toll in China from the coronavirus outbreak has exceeded 1,000, with the number of confirmed cases reaching nearly 43,000. Follow our live blog for updates: https://t.co/XDyPJJNBib"
1455,4898091,2020-02-11 11:33:12+00:00, ,1.22719E+18,en,31,0,1,9,,,,Ads Uploader for Twitter,"""Though we journalists are trained to create moral panics about each new generation, I came home disgusted at another generation of young people: my own. What degenerates we were."" https://t.co/f4iBucmkVd"
1452,4898091,2020-02-11 11:33:14+00:00, ,1.22719E+18,en,64,3,15,16,,,,Ads Uploader for Twitter,"""Though we journalists are trained to create moral panics about each new generation, I came home disgusted at another generation of young people: my own. What degenerates we were."" https://t.co/VGag665U6G"
1451,4898091,2020-02-11 11:33:14+00:00, ,1.22719E+18,en,63,3,11,6,,,,Ads Uploader for Twitter,"""In no particular order, things I have been irrationally terrified of during my life include: boa constrictors, crocodiles, tsunamis, the walking dead, white bread, spaghetti and a tray of brownies left unattended."" https://t.co/PVwaZRBaeN"
1449,4898091,2020-02-11 11:33:17+00:00, ,1.22719E+18,en,19,1,6,5,,,,Ads Uploader for Twitter,"""Though we journalists are trained to create moral panics about each new generation, I came home disgusted at another generation of young people: my own. What degenerates we were."" https://t.co/L4VA9WMZOl"
