,author id,created_at,geo,id,lang,like_count,quote_count,reply_count,retweet_count,positive SA value,Negative SA values,Compound,source,tweet
583,4898091,2020-02-21 21:00:09+00:00, ,1.23096E+18,en,12,0,1,2,,,,SocialFlow,Isabel Berwick: The side effects of my hobby’s sudden popularity include having to share it with large numbers of Instagramming tourists who google-map their way to the pond https://t.co/Z9sVUCYwzA
582,4898091,2020-02-21 21:20:04+00:00, ,1.23097E+18,en,10,1,2,5,,,,SocialFlow,As one prominent Democratic fundraiser and donor put it about this week's debate: 'Bloomberg the man had a head-on collision with Bloomberg the brand.' Can the New York billionaire recover from the painful moments of his first presidential debate? https://t.co/IGaG9tYiwZ
579,4898091,2020-02-21 22:00:13+00:00, ,1.23098E+18,en,10,1,2,1,,,,SocialFlow,"What do you get when you combine an activist, anti-establishment fish with an egomaniacal, capitalist human? @mermaidpalace, an audio company founded by award-winning podcaster @kaitlinprest. Hear more on the latest episode of FT Culture Call: https://t.co/oRVmglcXwU https://t.co/bpObZAOitE"
577,4898091,2020-02-21 22:30:15+00:00, ,1.23098E+18,en,17,0,1,8,,,,SocialFlow,"Just published: front page of FT Weekend, international edition, Saturday 22 February         https://t.co/tj2G0tccAt https://t.co/Oyxt8xPv3v"
575,4898091,2020-02-21 23:00:14+00:00, ,1.23099E+18,en,19,3,10,6,,,,SocialFlow,"'The Democrats would be working very hard to find someone who is as divisive as Trump. But with Bernie they would have succeeded,' @lloydblankfein tells the FT over lunch. 'I might find it harder voting for Bernie than Trump.' Read more: https://t.co/nU9kCBU0tQ"
574,4898091,2020-02-21 23:20:09+00:00, ,1.231E+18,en,13,0,1,3,,,,SocialFlow,A great big question mark has hung over Prada in recent months – amid speculation of an imminent takeover. So its show at Milan Fashion Week was inevitably anticlimactic https://t.co/P0McsMUT2D
569,4898091,2020-02-22 04:05:07+00:00, ,1.23107E+18,en,12,1,0,1,,,,SocialFlow,How to ‘do the splits’ on your mortgage https://t.co/DqjSc5qxBY
568,4898091,2020-02-22 06:03:03+00:00, ,1.2311E+18,en,15,1,2,5,,,,SocialFlow,Miuccia Prada's latest collection riffed on her greatest hits – the problem is that the Prada customer already owns most of these https://t.co/0KlDS9s0SV
566,4898091,2020-02-22 10:03:06+00:00, ,1.23116E+18,en,27,3,3,7,,,,SocialFlow,Will you be reading the final novel in Hilary Mantel's Thomas Cromwell trilogy? https://t.co/ZqODrJ1r32
565,4898091,2020-02-22 11:13:04+00:00, ,1.23118E+18,en,41,3,4,35,,,,SocialFlow,Coronavirus may be worse than Wall Street is wagering https://t.co/BOLQO8UeYO
564,4898091,2020-02-22 11:13:04+00:00, ,1.23118E+18,en,18,7,4,5,,,,SocialFlow,Why it’s time to cut back on glass wine bottles https://t.co/7DjLqtC7g3
562,4898091,2020-02-22 12:29:01+00:00, ,1.23119E+18,en,9,3,0,4,,,,SocialFlow,Poland’s culture war spreads to acclaimed Jewish history museum https://t.co/drskV7Wrzf
558,4898091,2020-02-22 15:46:42+00:00, ,1.23124E+18,en,11,0,1,2,,,,SocialFlow,Democratic volunteers go low-tech for Nevada caucus https://t.co/5rHJ0Trwei
557,4898091,2020-02-22 16:05:07+00:00, ,1.23125E+18,en,50,4,7,24,,,,SocialFlow,"A once unthinkable idea is fast becoming mainstream: emissions should be cut to net zero as soon as possible. The question is, how? https://t.co/IMFBUpQYBf"
556,4898091,2020-02-22 17:02:05+00:00, ,1.23126E+18,en,24,1,10,5,,,,SocialFlow,It would make a massive difference to wine’s impact on climate change if we stopped transporting it in glass bottles. Time for wine in a box to have its big moment https://t.co/oAsgV3ZSzv
554,4898091,2020-02-22 18:02:10+00:00, ,1.23128E+18,en,30,2,2,13,,,,SocialFlow,"In less than a decade, WeWork went from promising to turn dull offices into empowering communities for restless entrepreneurs to being New York’s largest commercial tenant. 

Then the ultimate unicorn lost its billions. 

Here's how everything went wrong: https://t.co/bR39BrraW7 https://t.co/CgPJcNhrpF"
552,4898091,2020-02-22 20:07:06+00:00, ,1.23131E+18,en,21,2,1,9,,,,SocialFlow,Janan Ganesh: Will Liverpool’s machine football conquer America? https://t.co/mmAkCKhEwU
551,4898091,2020-02-22 22:05:07+00:00, ,1.23134E+18,en,19,0,0,10,,,,SocialFlow,Henry Moore and Bill Brandt: two giants of British modernism and their intersecting oeuvres are brought together for the first time at the Hepworth Wakefield https://t.co/z2Zq7KCXgf
550,4898091,2020-02-23 01:01:07+00:00, ,1.23138E+18,en,19,0,1,7,,,,SocialFlow,The problem with choosing a place to dine solo in Tokyo is not the lack of options but that there are too many choices. Here's where to start https://t.co/nCUcRntL3l
549,4898091,2020-02-23 01:01:57+00:00, ,1.23138E+18,en,20,2,3,6,,,,SocialFlow,Sanders on course for victory in Nevada caucuses https://t.co/5WK5SsqWdz
548,4898091,2020-02-23 02:19:13+00:00, ,1.2314E+18,en,23,0,10,15,,,,SocialFlow,China wildlife trade under scrutiny coronavirus outbreak https://t.co/IGqZgYmO5x
545,4898091,2020-02-23 03:20:00+00:00, ,1.23142E+18,en,59,5,5,50,,,,SocialFlow,New Zealand finance minister warns on foreign influence https://t.co/Vzy6nHqXqY
544,4898091,2020-02-23 05:02:31+00:00, ,1.23144E+18,en,16,0,0,6,,,,SocialFlow,The best career advisers know our plans aren’t built to last https://t.co/QWsgAfEwE8
542,4898091,2020-02-23 06:07:08+00:00, ,1.23146E+18,en,13,5,2,6,,,,SocialFlow,Philippines: Rodrigo Duterte takes aim at the oligarchs https://t.co/V1mibnD1s9
540,4898091,2020-02-23 09:04:05+00:00, ,1.2315E+18,en,42,6,2,12,,,,SocialFlow,That feeling you get when your favourite underground hobby becomes mainstream finally has a name https://t.co/XSab29Mcr0
538,4898091,2020-02-23 09:55:00+00:00, ,1.23152E+18,en,18,1,2,9,,,,SocialFlow,Risks build in world’s largest bond funds https://t.co/iiGHHDlcre
536,4898091,2020-02-23 11:07:23+00:00, ,1.23154E+18,en,16,0,1,11,,,,SocialFlow,Georgia seeks more western military support to counter Russia threat https://t.co/2r3OsF07nS
535,4898091,2020-02-23 11:14:08+00:00, ,1.23154E+18,en,3,0,0,4,,,,SocialFlow,Luxembourg regulator accused of failing to protect investors https://t.co/vSvdQK1wDL
534,4898091,2020-02-23 11:14:09+00:00, ,1.23154E+18,en,44,1,2,23,,,,SocialFlow,Corporate leaders should show a little human kindness https://t.co/s5sBPfjBDS
533,4898091,2020-02-23 11:24:31+00:00, ,1.23154E+18,en,61,8,7,64,,,,SocialFlow,Italy quarantines a dozen towns in coronavirus outbreak https://t.co/ToFWCNygZR
531,4898091,2020-02-23 12:11:51+00:00, ,1.23155E+18,en,20,3,3,8,,,,SocialFlow,Brazil poised to make central bank independent of political control https://t.co/G08qYqNfc1
530,4898091,2020-02-23 12:11:52+00:00, ,1.23155E+18,en,11,1,0,3,,,,SocialFlow,French far-right targets disaffected Perpignan https://t.co/AXBmMyF19Q
529,4898091,2020-02-23 12:21:19+00:00, ,1.23155E+18,en,35,1,1,6,,,,SocialFlow,Raf Simons to join Prada as co-creative director https://t.co/zbZEQK8RUH
528,4898091,2020-02-23 13:05:03+00:00, ,1.23157E+18,en,37,1,4,11,,,,SocialFlow,"Skjervoy had been just another sleepy fishing village in the Norwegian Arctic – until October 2017 when locals found their nearby fjord suddenly full of humpback and killer whales, thanks to migrating herring shoals. Now you can snorkel with them https://t.co/9se3cBFh8z"
526,4898091,2020-02-23 15:10:04+00:00, ,1.2316E+18,en,32,4,3,23,,,,SocialFlow,"It’s hard to look at Kensington’s neat blocks of luxury houses without wondering what degradation lurks behind the doors. 

Uncovering the modern slavery endemic happening in London’s wealthiest borough: https://t.co/AwB0oIFvhu"
525,4898091,2020-02-23 16:20:35+00:00, ,1.23161E+18,en,17,1,1,4,,,,SocialFlow,Chinese carmakers accelerate drive into India https://t.co/gCDtgse3Zr
524,4898091,2020-02-23 16:25:06+00:00, ,1.23162E+18,en,20,2,2,6,,,,SocialFlow,JetBlue signs loan linked to ESG goals https://t.co/a7aQ1s3S2r
523,4898091,2020-02-23 17:05:03+00:00, ,1.23163E+18,en,7,2,3,9,,,,SocialFlow,Merryn Somerset Webb: You might not like the thought of paying tax on your pension contributions — but it’s coming https://t.co/JPDQ3IHTdu
522,4898091,2020-02-23 19:05:05+00:00, ,1.23166E+18,en,20,2,0,6,,,,SocialFlow,Heritage styles are making a massive comeback in the interiors world as maximalism is championed by a new generation of designers https://t.co/7lVZMBBEER
519,4898091,2020-02-23 21:30:09+00:00, ,1.23169E+18,en,23,3,2,27,,,,SocialFlow,"Just published: front page of the Financial Times, UK edition, Monday 24 February         https://t.co/WTMORwALf3 https://t.co/SqGS750yro"
518,4898091,2020-02-23 21:38:57+00:00, ,1.23169E+18,en,7,1,0,12,,,,SocialFlow,Jean Pierre Mustier rules himself out of HSBC running https://t.co/CV076o6j4W
517,4898091,2020-02-23 22:00:58+00:00, ,1.2317E+18,en,13,2,6,6,,,,SocialFlow,National security adviser rejects talk of Russian meddling in US election https://t.co/GRO4jYedPH
511,4898091,2020-02-24 03:23:19+00:00, ,1.23178E+18,en,5,0,0,1,,,,SocialFlow,Global investors warn South Korea’s Kepco over carbon emissions https://t.co/17e5KQtnzN
512,4898091,2020-02-24 03:23:19+00:00, ,1.23178E+18,en,31,2,3,18,,,,SocialFlow,Oil and Asia stocks slump as coronavirus spreads outside China https://t.co/KwmGOo8P3c
510,4898091,2020-02-24 03:23:19+00:00, ,1.23178E+18,en,20,0,2,11,,,,SocialFlow,Coronavirus latest: Rise in cases outside China rattles markets https://t.co/8OP5vBDIuP
509,4898091,2020-02-24 03:31:39+00:00, ,1.23178E+18,en,38,2,2,23,,,,SocialFlow,"Oil prices slumped, Asian equities retreated and US stock futures fell after coronavirus cases jumped in Italy and South Korea over the weekend. Follow our live coverage here:  https://t.co/HBSOU0T7WI"
507,4898091,2020-02-24 04:20:10+00:00, ,1.2318E+18,en,14,2,0,13,,,,SocialFlow,FT Exclusive: International funds including the Church of England are slashing holdings in Korea Electric Power Corp over the state-backed utility’s lack of progress cutting carbon emissions https://t.co/FOmfPhdlmM https://t.co/m2e1J8UFyN
506,4898091,2020-02-24 04:40:07+00:00, ,1.2318E+18,en,17,1,2,12,,,,SocialFlow,Rising incomes have resulted in increased demand in China for wild animals. But the animal trade’s suspected role in the coronavirus outbreak has drawn the attention of leadership in Beijing https://t.co/H56iAVrVXm
505,4898091,2020-02-24 05:00:05+00:00, ,1.23181E+18,en,24,4,1,12,,,,SocialFlow,Rodrigo Duterte has shifted from targeting drug dealers to the Philippines’ ‘oligarchs’ in media and big business in what some see as a legacy-defining power play. The campaign has made him even more popular https://t.co/w6aTXsxgtG
502,4898091,2020-02-24 06:00:07+00:00, ,1.23182E+18,en,10,1,1,7,,,,SocialFlow,"FT Exclusive: Barclays is preparing to start the search to replace chief executive Jes Staley, the latest European bank to seek new leadership https://t.co/elwi3kmPPK https://t.co/qvfdb3AE26"
499,4898091,2020-02-24 07:00:07+00:00, ,1.23184E+18,en,19,2,2,21,,,,SocialFlow,"Just in: Mahathir Mohamad, Malaysia's prime minister, has submitted his resignation after 24 hours of turmoil within the country's governing coalition https://t.co/bJUBYzy3V4"
498,4898091,2020-02-24 07:15:02+00:00, ,1.23184E+18,en,41,4,4,40,,,,SocialFlow,"If you’re just waking up, here’s the latest coronavirus news: 
👉Outbreak spikes in Italy and South Korea rattled markets
👉China reported 409 new cases and 150 deaths
👉Pakistan and Afghanistan closed land borders with Iran
Follow our live coverage: https://t.co/maRrqwnq5B"
497,4898091,2020-02-24 07:30:06+00:00, ,1.23184E+18,en,12,2,0,2,,,,SocialFlow,"Iran has sustained military spending despite the Trump administration’s debilitating sanctions, a military adviser to the supreme leader told the Financial Times in a rare interview https://t.co/aPrksCH8E7 https://t.co/7q9x5JvqMB"
496,4898091,2020-02-24 07:44:39+00:00, ,1.23185E+18,en,0,0,0,8,,,,SocialFlow,RT @bydavidcrow: It’s merry go round Monday for bank CEO jobs. Barclays poised to kick off search to replace Staley https://t.co/BDgWTyDekv…
493,4898091,2020-02-24 08:15:03+00:00, ,1.23186E+18,en,18,3,1,6,,,,SocialFlow,"Rishi Sunak must raise taxes, bend fiscal rules or both if he intends to increase day-to-day spending on public services and end austerity, according to the Resolution Foundation https://t.co/YXj1ZWRzaM"
489,4898091,2020-02-24 09:20:07+00:00, ,1.23187E+18,en,13,1,1,8,,,,SocialFlow,Britain’s Home Office has dismissed ‘false allegations’ that MI5 withheld information from Priti Patel over concerns about her abilities https://t.co/6LFHxZATcx
488,4898091,2020-02-24 09:40:05+00:00, ,1.23188E+18,en,14,0,0,4,,,,SocialFlow,"Governments’ travel advisories matter, Michael Skapinker rites. But accusations of bias against poorer countries have a long history https://t.co/C1X20tTeud https://t.co/WxKCahI7gS"
486,4898091,2020-02-24 10:20:05+00:00, ,1.23189E+18,en,0,0,0,23,,,,SocialFlow,RT @TonyTassell: Finance read of the day: A dive into BlackRock's black box technology system Aladdin which has become a hugely powerful ly…
484,4898091,2020-02-24 11:00:05+00:00, ,1.2319E+18,en,9,1,2,5,,,,SocialFlow,"Barclays is preparing to start the search for a new chief executive to replace Jes Staley, making it the latest European bank to look for new leadership at a time of upheaval in the industry’s top ranks https://t.co/3KWMriTpBT"
479,4898091,2020-02-24 12:20:08+00:00, ,1.23192E+18,en,15,1,0,9,,,,SocialFlow,"The new law will require all companies — apart from those with fewer than 50 employees or less than £10.2m annual turnover — to assess the employment status of any person they hire, who works through a limited company https://t.co/qmxfeC1OTM"
478,4898091,2020-02-24 12:40:03+00:00, ,1.23192E+18,en,30,2,5,15,,,,SocialFlow,"'It is imperative the US and other Wipo members that are concerned about IP protection and its positive effect on investment and innovation wake up,' writes Peter Navarro, assistant to the US president for trade and manufacturing policy https://t.co/r10LiVIsTj"
477,4898091,2020-02-24 13:00:07+00:00, ,1.23193E+18,en,26,0,2,12,,,,SocialFlow,"It has been a busy morning in Europe as fears have intensified over the spread of the coronavirus. Here's a round-up of what we know👇:

https://t.co/I5IRQDLANq"
473,4898091,2020-02-24 14:00:12+00:00, ,1.23194E+18,en,29,0,1,12,,,,SocialFlow,"Nick Butler: We need to learn from experience that international structures matter. If we did not have a WHO today, we would have to create one to deal with the challenge of the coronavirus
https://t.co/bdX1tEVTZt"
472,4898091,2020-02-24 14:40:06+00:00, ,1.23195E+18,en,15,2,0,14,,,,SocialFlow,"Only a fifth of the companies surveyed plan to increase staff, while 24% intend to cut employee numbers as Brexit gloom persists 
https://t.co/Ev1uuMz8ZF"
470,4898091,2020-02-24 15:00:18+00:00, ,1.23196E+18,en,71,3,0,29,,,,SocialFlow,"Sir Tim Berners-Lee helped invent the world wide web in 1989. His new start-up, Inrupt, seeks to decentralise the web and hand power from giant corporations back to users https://t.co/JywYqvxk7G"
466,4898091,2020-02-24 16:20:13+00:00, ,1.23198E+18,en,77,3,1,82,,,,SocialFlow,"Milan has shut down schools, offices and tourist attractions as part of its response to the coronavirus outbreak 
https://t.co/19sAroAfjp"
464,4898091,2020-02-24 17:00:16+00:00, ,1.23199E+18,en,14,0,2,10,,,,SocialFlow,"Opinion: Not only does surveillance frighten employees away from articulating concerns, it also deters them from articulating opportunities
https://t.co/C7DWYsD4h8"
463,4898091,2020-02-24 17:20:06+00:00, ,1.23199E+18,en,22,1,0,4,,,,SocialFlow,Leadership lessons: How learning fast on the job has been critical to transforming a garage-style operation into a multinational with 12 offices in six countries https://t.co/XGyZwZSOLz
461,4898091,2020-02-24 17:29:27+00:00, ,1.23199E+18,en,0,0,0,0,,,,Ads Uploader for Twitter,"Aladdin, BlackRock’s vast technology platform, acts as the central nervous system for many of the investment industry’s largest participants. But its scale could raise conflicts of interest that make it a liability. https://t.co/jDgG8vqMLi"
459,4898091,2020-02-24 17:40:10+00:00, ,1.232E+18,en,56,7,6,25,,,,SocialFlow,"Harvey Weinstein was found guilty of third-degree rape and a first-degree criminal sexual act by a New York jury, in a verdict that could send the him to prison for up to 25 years https://t.co/28ecCLQhr2"
458,4898091,2020-02-24 18:00:13+00:00, ,1.232E+18,en,0,0,0,7,,,,SocialFlow,"RT @FTLifeArts: As Harvey Weinstein is found guilty of rape, here's a look back at the case that will define the #MeToo era https://t.co/kg…"
455,4898091,2020-02-24 18:40:02+00:00, ,1.23201E+18,en,21,0,3,6,,,,SocialFlow,"Opinion: The US president's trip to India gives the two countries a chance to move some of their regional agenda forward. But if they do not get their own houses in order, China’s behaviour alone will not be sufficient to power their partnership https://t.co/lmvFYXzrXa"
453,4898091,2020-02-24 19:00:16+00:00, ,1.23202E+18,en,19,2,2,12,,,,SocialFlow,"Nick Butler: We need to learn from experience that international structures matter. If we did not have a WHO today, we would have to create one to deal with the challenge of the coronavirus https://t.co/m0H2lXVIhF"
452,4898091,2020-02-24 19:01:10+00:00, ,1.23202E+18,en,22,1,3,18,,,,SocialFlow,Israel and Palestinians exchange rocket fire after border clash https://t.co/uJpnLtIkYz
451,4898091,2020-02-24 19:20:06+00:00, ,1.23202E+18,en,73,6,3,43,,,,SocialFlow,"Sir Tim Berners-Lee helped invent the world wide web in 1989. His new start-up, Inrupt, seeks to decentralise the web and hand power from giant corporations back to users https://t.co/quzfrCE27V"
450,4898091,2020-02-24 19:40:05+00:00, ,1.23203E+18,en,39,2,3,11,,,,SocialFlow,"As boorish, drunken behaviour becomes increasingly less acceptable in the workplace, demand for meaningful events, teambuilding and experiences is on the rise. https://t.co/OT87e6OBRG"
448,4898091,2020-02-24 20:00:20+00:00, ,1.23203E+18,en,10,1,0,6,,,,SocialFlow,"Iranian authorities are battling two fronts: a coronavirus outbreak that has killed eight people and infected at least 43, and widespread public distrust https://t.co/bIZXpj04Fa"
445,4898091,2020-02-24 21:00:13+00:00, ,1.23205E+18,en,14,2,1,10,,,,SocialFlow,"'It is imperative the US and other Wipo members that are concerned about IP protection and its positive effect on investment and innovation wake up,' writes Peter Navarro, assistant to the US president for trade and manufacturing policy https://t.co/EbFN9WlR99"
443,4898091,2020-02-24 21:30:13+00:00, ,1.23206E+18,en,22,1,3,17,,,,SocialFlow,"Just published: front page of the Financial Times, UK edition, Tuesday 25 February         https://t.co/tacPbxil9V https://t.co/wpblMstxo3"
442,4898091,2020-02-24 21:56:02+00:00, ,1.23206E+18,en,16,1,0,9,,,,SocialFlow,HP launches $16bn buyback as it ‘engages’ on Xerox deal https://t.co/9yNCemWlWZ
441,4898091,2020-02-24 22:00:07+00:00, ,1.23206E+18,en,19,1,1,21,,,,SocialFlow,"US stocks had their worst fall in two years, and Treasury yields sank towards historic lows, after a jump in the number of coronavirus cases outside China triggered a bout of volatility and tumult for global markets. Follow live updates and analysis here: https://t.co/QAGDIZUJQp"
438,4898091,2020-02-24 23:17:27+00:00, ,1.23208E+18,en,10,1,3,12,,,,SocialFlow,Markets face fresh jolt of coronavirus nerves https://t.co/iAuyLOSm3D
436,4898091,2020-02-25 00:28:48+00:00, ,1.2321E+18,en,8,1,0,2,,,,SocialFlow,Fed policymaker says more evidence needed for rate cut https://t.co/bmwrgql7zj
435,4898091,2020-02-25 00:57:17+00:00, ,1.23211E+18,en,10,1,0,9,,,,SocialFlow,Coronavirus latest: Stock markets in the Asia-Pacific region take new hit https://t.co/wF7pdGnkUb
434,4898091,2020-02-25 01:30:03+00:00, ,1.23212E+18,en,46,1,1,32,,,,SocialFlow,Japan’s Topix was down 3.7% on Tuesday after global markets suffered their worst day in two years as the number of coronavirus cases outside China spiked. Follow our live coverage here: https://t.co/4H6ImLgpHu
432,4898091,2020-02-25 03:30:35+00:00, ,1.23215E+18,en,20,3,2,13,,,,SocialFlow,The White House said it will formally ask Congress for $2.5bn to combat the spread of coronavirus in the US. Follow our live coverage: https://t.co/rFjOKErQQb
430,4898091,2020-02-25 04:03:35+00:00, ,1.23215E+18,en,20,2,2,14,,,,SocialFlow,"Gideon Rachman: If the acceptability of annexation spreads, it would result in bloodshed and the displacement of populations https://t.co/nPNFY3272e"
429,4898091,2020-02-25 04:20:15+00:00, ,1.23216E+18,en,69,8,2,38,,,,SocialFlow,Shares in Moderna soared 15.6% after the Boston-based biotech start-up become the first to release a potential coronavirus vaccine https://t.co/fasjBe0aSJ
428,4898091,2020-02-25 04:40:03+00:00, ,1.23216E+18,en,27,4,1,12,,,,SocialFlow,The World Bank’s special pandemic bonds are an attempt to use capital markets to support aid. But the bonds have come under scrutiny for giving investors high double-digit coupons while outbreaks afflict the developing world https://t.co/7v5OSlTBGn
427,4898091,2020-02-25 05:00:06+00:00, ,1.23217E+18,en,642,12,40,612,,,,SocialFlow,"As Xi Jinping vows to restart China’s economy, a marked slowdown in reported new coronavirus cases is helping his cause. But experts are puzzling over the figures https://t.co/q5qICVUVBo"
426,4898091,2020-02-25 05:20:05+00:00, ,1.23217E+18,en,14,0,3,7,,,,SocialFlow,"A lawyer for Julian Assange accused the US of acting in bad faith, including contemplating having the WikiLeaks founder poisoned or kidnapped while he was hiding in Ecuador’s embassy in London between 2012 and 2019 https://t.co/dZV0EYZ60l"
425,4898091,2020-02-25 05:39:06+00:00, ,1.23218E+18,en,37,3,0,32,,,,SocialFlow,"Winemakers have traditionally taken pride in their artisanal skills. But climate change, a shrinking labour force and stalling demand, have forced some to turn to GPS-tracked sniffer dogs and UV light zapping robots https://t.co/bJxERpdcIP"
424,4898091,2020-02-25 06:00:13+00:00, ,1.23218E+18,en,104,82,88,102,,,,SocialFlow,"The UK’s negotiating position has hardened since Brexit last month. But for the first time, Downing Street has explicitly said it would prioritise sovereignty over British businesses https://t.co/LbPwWCBG46"
423,4898091,2020-02-25 06:20:02+00:00, ,1.23219E+18,en,985,16,51,1025,,,,SocialFlow,"Relations between Swedish and Chinese towns are deteriorating over the fate of Gui Minhai, a Hong Kong book publisher and Swedish citizen who was sentenced to 10 years in prison on Tuesday https://t.co/yIplHWB6I8"
420,4898091,2020-02-25 07:30:02+00:00, ,1.23221E+18,en,15,0,0,18,,,,SocialFlow,"English life expectancy progress has stalled for the first sustained period in 120 years after a decade of austerity, according to an expert on the link between social deprivation and health https://t.co/RSUCQRKTfA https://t.co/qxx5DiieyO"
418,4898091,2020-02-25 08:00:10+00:00, ,1.23221E+18,en,11,1,0,6,,,,SocialFlow,"Boris Johnson’s government enjoys an 80-seat Commons majority, but its stability has been shaken as a radical cadre of officials in Number 10 attempt to bend the Whitehall machine to their will https://t.co/qknO2vyvcQ"
416,4898091,2020-02-25 08:30:08+00:00, ,1.23222E+18,en,11,0,0,6,,,,SocialFlow,Libya’s 10-month conflict faces growing internationalisation. Outside powers may end up determining whether the fighting ends https://t.co/BrAuWNyGpK
415,4898091,2020-02-25 08:45:02+00:00, ,1.23222E+18,en,0,0,0,31,,,,SocialFlow,"RT @JamieSmythF: Equinor becomes the third oil giant to abandon plans to drill the Great Australian Bight, a pristine marine park: reflecti…"
414,4898091,2020-02-25 09:00:09+00:00, ,1.23223E+18,en,8,2,4,3,,,,SocialFlow,"Michael Skapinker:The food industry can lower their products’ fat, salt and sugar content to avoid black labels. Either that or squeal https://t.co/Nvwa4DyIBv https://t.co/1r3glVZLSW"
413,4898091,2020-02-25 09:20:02+00:00, ,1.23223E+18,en,31,4,0,9,,,,SocialFlow,"For hundreds of years, Japanese company owners have used the practice of ‘mukoyoshi ’ to recruit talent, giving rise to the saying ‘You can’t choose your sons, but you can choose your sons-in-law’. https://t.co/aiTivnfW3l"
411,4898091,2020-02-25 10:00:06+00:00, ,1.23224E+18,en,0,0,0,5,,,,SocialFlow,"RT @OilSheppard: Might BP quit the API? 

Oil lobby group defends credentials amid BP green review #OOTT https://t.co/JrIr2iTOD3"
409,4898091,2020-02-25 10:02:47+00:00, ,1.23224E+18,en,133,13,19,93,,,,Ads Uploader for Twitter,"Imagine a world in which cross-border banking, online shopping and data sharing becomes bifurcated between two systems. That is a reality we may be heading towards. https://t.co/SUUOfXBJFK"
405,4898091,2020-02-25 10:02:49+00:00, ,1.23224E+18,en,2,0,0,2,,,,Ads Uploader for Twitter,"The art trade seems almost ridiculously tailor-made for money laundering — because of the value of some pieces, because they are usually easily portable, and most of all because of the cult of secrecy that holds sway in the sector. https://t.co/yGJzTuxhnY"
404,4898091,2020-02-25 10:02:50+00:00, ,1.23224E+18,en,73,21,43,77,,,,Ads Uploader for Twitter,"London has about 70,000 Airbnb listings, the highest number of any city in the world. Nowhere else comes close: New York has about 40,000 holiday-let listings; Paris has about 39,000 — so why are Londoners relaxed about it? https://t.co/gvEn0iuyMv"
402,4898091,2020-02-25 10:02:51+00:00, ,1.23224E+18,en,0,0,0,1,,,,Ads Uploader for Twitter,Too much career advice still assumes it is possible to control working lives in an age of remorseless downsizing and gig economics. https://t.co/zM0JbkenCT
