,Source.Name,author id,created_at,geo,id,lang,like_count,quote_count,reply_count,retweet_count,source,tweet
775,FinancialTimesv3_0516.csv,4898091,13/05/2020 22:30, ,1.26068e+18,en,28,2,5,21,SocialFlow,Fed chairman Jay Powell says additional fiscal stimulus may be ‘worth it’ to shield the US economy from long-term damage due to the pandemic https://t.co/Ga9ydnH8Fo
4496,FinancialTimesv3_May1000.csv,4898091,13/05/2020 22:50, ,1.26069e+18,en,23,7,2,21,,
3240,FinancialTimesv3_May.csv,4898091,13/05/2020 23:10, ,1.26069e+18,en,91,6,5,37,SocialFlow,Musk wins battle over Tesla factory reopening https://t.co/eYUmpt5kta
769,FinancialTimesv3_0516.csv,4898091,13/05/2020 23:30, ,1.2607e+18,en,32,3,2,23,SocialFlow,David Pilling: The ugly battle for protective gear would be a sideshow compared to one over a vaccine https://t.co/xnBbKYJHX7
3238,FinancialTimesv3_May.csv,4898091,13/05/2020 23:40, ,1.2607e+18,en,14,0,0,3,SocialFlow,S Africa plans localised lockdowns as pressure mounts to reopen https://t.co/eJEwPePVIh
766,FinancialTimesv3_0516.csv,4898091,14/05/2020 01:30, ,1.26073e+18,en,13,1,1,12,SocialFlow,"How do promises of rocket planes and ageing cures sit with our failure to stop coronavirus? @Skapinker looks at the humbling truths about the limits of innovation through ‘The Future Is Faster Than You Think’, a brightly written, thought-provoking read https://t.co/yal9zg7p8L"
4499,FinancialTimesv3_May1000.csv,4898091,14/05/2020 01:44, ,1.26073e+18,en,14,0,8,10,,
4502,FinancialTimesv3_May1000.csv,4898091,14/05/2020 01:48, ,1.26073e+18,en,25,3,9,16,,
760,FinancialTimesv3_0516.csv,4898091,14/05/2020 02:26, ,1.26074e+18,en,97,16,3,50,SocialFlow,Japan preps ice-cold face masks for summer heat https://t.co/pQCnTmRfoP
759,FinancialTimesv3_0516.csv,4898091,14/05/2020 02:26, ,1.26074e+18,en,17,3,0,14,SocialFlow,Chinese companies under fire as side bets on stocks turn sour https://t.co/2Uo2qCA9Ui
3229,FinancialTimesv3_May.csv,4898091,14/05/2020 02:26, ,1.26074e+18,en,17,3,0,14,SocialFlow,Chinese companies under fire as side bets on stocks turn sour https://t.co/2Uo2qCA9Ui
758,FinancialTimesv3_0516.csv,4898091,14/05/2020 02:30, ,1.26074e+18,en,30,0,2,10,SocialFlow,"Opinion: Even before the pandemic, Tokyo had taken a more holistic view of corporations’ collective role in the national interest and in maintaining the desired contours of the world’s third-biggest economy https://t.co/y13djks2OH"
755,FinancialTimesv3_0516.csv,4898091,14/05/2020 03:00, ,1.26075e+18,en,18,2,2,7,SocialFlow,"Cold-war nuclear tests could help efforts to understand the Earth’s atmosphere, and potentially how to modify it https://t.co/ZwM78hHiCl"
3225,FinancialTimesv3_May.csv,4898091,14/05/2020 03:00, ,1.26075e+18,en,18,2,2,7,SocialFlow,"Cold-war nuclear tests could help efforts to understand the Earth’s atmosphere, and potentially how to modify it https://t.co/ZwM78hHiCl"
754,FinancialTimesv3_0516.csv,4898091,14/05/2020 03:30, ,1.26076e+18,en,53,7,5,30,SocialFlow,"Opinion: The battle between nations over tests and personal protective gear will be a sideshow compared to the scramble over a vaccine. Yet if a vaccine is to be anything like the silver bullet that some imagine, it will have to be available to everyone https://t.co/p3FwPjgNJr"
3219,FinancialTimesv3_May.csv,4898091,14/05/2020 05:41, ,1.26079e+18,en,179,22,10,134,Twitter Web App,"More than 135 public figures, including 50 former world leaders, have called for a ‘people’s vaccine’ against Covid-19 to be patent-free and made available at no cost https://t.co/J0Zb9kEoSA"
4507,FinancialTimesv3_May1000.csv,4898091,14/05/2020 06:20, ,1.2608e+18,en,58,9,8,34,,
3216,FinancialTimesv3_May.csv,4898091,14/05/2020 06:56, ,1.26081e+18,en,41,4,4,34,Twitter Web App,Nine in 10 Australians said their own nation had handled the pandemic ‘very well’ or ‘well’ — but just one in 10 said so of the US https://t.co/gednBmLjcM https://t.co/DiqmoYbVjD
3215,FinancialTimesv3_May.csv,4898091,14/05/2020 07:18, ,1.26082e+18,en,34,1,2,23,Twitter Web App,"FT Exclusive: The UK has formed a task force to examine how to decontaminate medical respirator masks to allow them to be worn repeatedly, already a widespread practice in the US https://t.co/w0QNdGtoj5 https://t.co/7mRuQ6Ugbs"
743,FinancialTimesv3_0516.csv,4898091,14/05/2020 07:45, ,1.26082e+18,en,24,1,3,19,Twitter Web App,"The NHS contact tracing app, a crucial part of the UK’s strategy to gradually ease lockdowns, risks excluding millions of people, an ethics advisory board warned: 21% of adults do not use a smartphone https://t.co/dbfsI7Hdct"
742,FinancialTimesv3_0516.csv,4898091,14/05/2020 08:02, ,1.26083e+18,en,21,4,3,18,Twitter Web App,FT Big Read: The hunt for a vaccine — which experts believe to be at least 12 to 18 months away — is central to restarting economies. But will countries act in narrow self-interest or embrace a collaborative global approach? https://t.co/MFlLGtiebD
739,FinancialTimesv3_0516.csv,4898091,14/05/2020 08:40, ,1.26084e+18,en,74,4,6,44,SocialFlow,Philip Stephens: This is not the premiership Boris Johnson anticipated. Nor is it one he looks to be enjoying https://t.co/iIagtBiliZ
3208,FinancialTimesv3_May.csv,4898091,14/05/2020 09:00, ,1.26084e+18,en,11452,1115,781,6964,SocialFlow,Edward Luce spoke with dozens of officials to discover what went wrong in Donald Trump’s first real crisis — and found a president who ignored increasingly urgent intelligence warnings and dismissed anyone who claimed to know more than him https://t.co/jSkLQL4KCS
738,FinancialTimesv3_0516.csv,4898091,14/05/2020 09:00, ,1.26084e+18,en,11452,1115,781,6964,SocialFlow,Edward Luce spoke with dozens of officials to discover what went wrong in Donald Trump’s first real crisis — and found a president who ignored increasingly urgent intelligence warnings and dismissed anyone who claimed to know more than him https://t.co/jSkLQL4KCS
3205,FinancialTimesv3_May.csv,4898091,14/05/2020 10:08, ,1.26086e+18,en,22,3,3,13,Twitter Web App,Surveyors expect a slow recovery after the property market fell into 'hibernation' in April as house viewings were banned and estate agents closed as part of the efforts to limit the spread of coronavirus https://t.co/QWHzP603Pf https://t.co/F3Ub950hUm
3204,FinancialTimesv3_May.csv,4898091,14/05/2020 10:19, ,1.26086e+18,en,0,0,0,15,Twitter Web App,"RT @sdbernard: UPDATE: May 13 #COVID19 streamgraph

• 7-day average falls below 5,000
• #US share of deaths is slowly declining as #LatinAm…"
4515,FinancialTimesv3_May1000.csv,4898091,14/05/2020 11:30, ,1.26088e+18,en,33,2,3,15,,
3198,FinancialTimesv3_May.csv,4898091,14/05/2020 12:30, ,1.2609e+18,en,157,10,3,65,SocialFlow,"It has been one of the few joys of the coronavirus crisis. As threatening trucks and cars have disappeared, family cycling groups have taken over once-forbidding roads https://t.co/7XQNMYKZO2"
3196,FinancialTimesv3_May.csv,4898091,14/05/2020 13:00, ,1.2609e+18,en,9,1,3,1,SocialFlow,"Opinion: Our lives have been upended — but from one corner of the globe to another, we seem to be finding a common language that captures the stresses, challenges and humour of this extraordinary time https://t.co/3lbtPJaRGY"
4517,FinancialTimesv3_May1000.csv,4898091,14/05/2020 13:30, ,1.26091e+18,en,12,0,2,3,,
4519,FinancialTimesv3_May1000.csv,4898091,14/05/2020 14:30, ,1.26093e+18,en,27,2,5,13,,
722,FinancialTimesv3_0516.csv,4898091,14/05/2020 15:00, ,1.26093e+18,en,18,2,3,6,SocialFlow,"J Crew, whose fashion-forward take on prep captured the American style zeitgeist in the mid-2000s, has become the first significant fashion casualty of the Covid-19 pandemic. @laureni takes a look at its trajectory 
https://t.co/PN4E0ioKO7 https://t.co/SIiCen5lxK"
3163,FinancialTimesv3_May.csv,4898091,14/05/2020 15:25, ,1.26094e+18,en,1,0,0,0,Ads Uploader for Twitter,Striking the right tone with staff is just one of the many challenges facing bank bosses from Wall Street to the City of London and Hong Kong’s Central district as they pave the way for a return to offices. https://t.co/u0YA4J7EYc
4520,FinancialTimesv3_May1000.csv,4898091,14/05/2020 15:25, ,1.26094e+18,en,1136,79,91,654,,
3178,FinancialTimesv3_May.csv,4898091,14/05/2020 15:25, ,1.26094e+18,en,1,0,1,1,Ads Uploader for Twitter,FT Big Read: The hunt for a vaccine — which experts believe to be at least 12 to 18 months away — is central to restarting economies. But will countries act in narrow self-interest or embrace a collaborative global approach? https://t.co/CZkDnosppe
4528,FinancialTimesv3_May1000.csv,4898091,14/05/2020 15:25, ,1.26094e+18,en,433,21,33,150,,
696,FinancialTimesv3_0516.csv,4898091,14/05/2020 15:25, ,1.26094e+18,en,1,0,0,2,Ads Uploader for Twitter,Edward Luce spoke with dozens of officials to discover what went wrong in Donald Trump’s first real crisis — and found a president who ignored increasingly urgent intelligence warnings and dismissed anyone who claimed to know more than him. https://t.co/5ezft1ETUj
4524,FinancialTimesv3_May1000.csv,4898091,14/05/2020 15:25, ,1.26094e+18,en,170,8,12,64,,
715,FinancialTimesv3_0516.csv,4898091,14/05/2020 15:25, ,1.26094e+18,en,0,0,0,0,Ads Uploader for Twitter,"More than 135 public figures, including 50 former world leaders, have called for a ""people’s vaccine"" against Covid-19 to be patent-free and made available at no cost. https://t.co/TYf1Ufd49D"
3191,FinancialTimesv3_May.csv,4898091,14/05/2020 15:25, ,1.26094e+18,en,3,0,0,1,Ads Uploader for Twitter,There are plenty of ways to break a proper sweat under house lockdown. So where to begin? Here FT staff share their routines. https://t.co/QqR7LCTbiq
4535,FinancialTimesv3_May1000.csv,4898091,14/05/2020 15:25, ,1.26094e+18,en,0,0,0,0,,
712,FinancialTimesv3_0516.csv,4898091,14/05/2020 15:25, ,1.26094e+18,en,170,8,12,64,Ads Uploader for Twitter,"The FT View: Had Donald Trump pardoned Michael Flynn, it would have been distasteful enough. What has happened instead is far worse. https://t.co/RpnDDxuUj0"
3180,FinancialTimesv3_May.csv,4898091,14/05/2020 15:25, ,1.26094e+18,en,0,0,0,2,Ads Uploader for Twitter,"Nearly 500 listed Chinese groups lost a collective Rmb11.2bn ($1.6bn) on their financial investments as the public health crisis caused China's stock market to drop, along with other major bourses around the world. https://t.co/MXxidPbtmc"
704,FinancialTimesv3_0516.csv,4898091,14/05/2020 15:25, ,1.26094e+18,en,65,2,3,36,Ads Uploader for Twitter,Edward Luce spoke with dozens of officials to discover what went wrong in Donald Trump’s first real crisis — and found a president who ignored increasingly urgent intelligence warnings and dismissed anyone who claimed to know more than him. https://t.co/Q0693AbvY1
4523,FinancialTimesv3_May1000.csv,4898091,14/05/2020 15:25, ,1.26094e+18,en,3,0,0,0,,
713,FinancialTimesv3_0516.csv,4898091,14/05/2020 15:25, ,1.26094e+18,en,3,0,0,0,Ads Uploader for Twitter,"The UN’s pleas for a global ceasefire during coronavirus have mostly fallen on deaf ears: 10 of 43 countries responded to the call, and in only two of those cases did violence significantly pause. https://t.co/vwYOYYNh6B"
3177,FinancialTimesv3_May.csv,4898091,14/05/2020 15:25, ,1.26094e+18,en,433,21,33,150,Ads Uploader for Twitter,Edward Luce spoke with dozens of officials to discover what went wrong in Donald Trump’s first real crisis — and found a president who ignored increasingly urgent intelligence warnings and dismissed anyone who claimed to know more than him. https://t.co/iETCLAudqd
690,FinancialTimesv3_0516.csv,4898091,14/05/2020 15:25, ,1.26094e+18,en,4,0,0,2,Ads Uploader for Twitter,Edward Luce spoke with dozens of officials to discover what went wrong in Donald Trump’s first real crisis — and found a president who ignored increasingly urgent intelligence warnings and dismissed anyone who claimed to know more than him. https://t.co/fCNEuYEFsd
691,FinancialTimesv3_0516.csv,4898091,14/05/2020 15:25, ,1.26094e+18,en,0,0,0,0,Ads Uploader for Twitter,Striking the right tone with staff is just one of the many challenges facing bank bosses from Wall Street to the City of London and Hong Kong’s Central district as they pave the way for a return to offices. https://t.co/RUQ3y9EP6y
4529,FinancialTimesv3_May1000.csv,4898091,14/05/2020 15:25, ,1.26094e+18,en,65,2,3,36,,
3156,FinancialTimesv3_May.csv,4898091,14/05/2020 16:30, ,1.26096e+18,en,10,1,1,6,SocialFlow,"As 'infodemic' and 'Covid-19' enter the radar of the Oxford English Dictionary, Nilanjana Roy reflects on how our responses to the pandemic are shaped by the words we use https://t.co/9chCpvGfbk"
3155,FinancialTimesv3_May.csv,4898091,14/05/2020 17:00, ,1.26096e+18,en,30,1,2,13,SocialFlow,"Around the world, bars, restaurants, hotels and visitor attractions are being reopened as lockdowns are gradually lifted. But getting there is another matter https://t.co/3SNCvGuTow"
3154,FinancialTimesv3_May.csv,4898091,14/05/2020 17:30, ,1.26097e+18,en,13,1,2,11,SocialFlow,"The FT's Sebastian Payne, explores the perilous times ahead for Prime Minister Boris Johnson, as the UK begins to ease the lockdown https://t.co/7p25iu0Og5"
683,FinancialTimesv3_0516.csv,4898091,14/05/2020 18:00, ,1.26098e+18,en,26,3,1,11,SocialFlow,"As the lockdown ends, cycling looks set to do more than helping people to pass the time. Here's how to start commuting by bike https://t.co/1fDbVeRI4U"
682,FinancialTimesv3_0516.csv,4898091,14/05/2020 18:30, ,1.26099e+18,en,8,1,0,4,SocialFlow,"Home buyers whose plans were put on ice under the coronavirus lockdown will see their mortgage options open up after the government announced measures to bring the property market out of limbo
https://t.co/9gRvfbnpOi"
681,FinancialTimesv3_0516.csv,4898091,14/05/2020 19:00, ,1.26099e+18,en,10,1,1,4,SocialFlow,"Will the pandemic bring a wave of defaults and bankruptcies, or will US government support help people who are struggling to stay afloat? Our US finance editor @rbrtrmstrng will be answering your questions about it on Instagram at 3pm EST (8pm BST) https://t.co/Wx3gu6pRe4 https://t.co/emc0FxvyZF"
4544,FinancialTimesv3_May1000.csv,4898091,14/05/2020 20:00, ,1.26101e+18,en,7,3,3,5,,
678,FinancialTimesv3_0516.csv,4898091,14/05/2020 20:05, ,1.26101e+18,en,12,0,3,1,SocialFlow,"Our US finance editor @rbrtrmstrng is live now on Instagram discussing whether the pandemic will bring a wave of defaults and bankruptcies, or whether government support will help people who are struggling to stay afloat. Join the conversation: https://t.co/z5fMLsyqyS https://t.co/bw7ZfOo76y"
3146,FinancialTimesv3_May.csv,4898091,14/05/2020 20:40, ,1.26102e+18,en,27,4,1,15,SocialFlow,"Just published: front page of the Financial Times, UK edition, Friday 15 May           https://t.co/8w0E1tFRHW https://t.co/grfZPmbv1p"
3144,FinancialTimesv3_May.csv,4898091,14/05/2020 21:30, ,1.26103e+18,en,39,5,1,24,SocialFlow,"Just published: front page of the Financial Times, international edition, Friday 15 May           https://t.co/0cfwTsbSuH https://t.co/VTlgjrl9W1"
3142,FinancialTimesv3_May.csv,4898091,14/05/2020 22:00, ,1.26104e+18,en,48,5,4,40,SocialFlow,"Health and care workers are six times more likely to catch the coronavirus, according to the first results from a UK population study https://t.co/HfYdBoZlSe"
3138,FinancialTimesv3_May.csv,4898091,15/05/2020 00:00, ,1.26107e+18,en,15,1,1,10,SocialFlow,Roberto Azevêdo will end his term early as head of the World Trade Organization in September https://t.co/d5bpTOFRQy
4555,FinancialTimesv3_May1000.csv,4898091,15/05/2020 00:37, ,1.26108e+18,en,22,1,0,10,,
666,FinancialTimesv3_0516.csv,4898091,15/05/2020 00:37, ,1.26108e+18,en,22,1,0,10,SocialFlow,WeWork slashed cash burn in first quarter https://t.co/432ZGCcttx
665,FinancialTimesv3_0516.csv,4898091,15/05/2020 00:51, ,1.26108e+18,en,26,3,1,16,SocialFlow,Taiwanese semiconductor group to build chip plant in Arizona https://t.co/lV9kDziMkG
3131,FinancialTimesv3_May.csv,4898091,15/05/2020 03:00, ,1.26111e+18,en,23,1,1,8,SocialFlow,"'It is classy television; you don’t need to know a tight end from a cornerback to understand that'. Michael Hann on Friday Night Lights, a show to obsess over.
https://t.co/qerNlrDBDh"
4559,FinancialTimesv3_May1000.csv,4898091,15/05/2020 05:41, ,1.26115e+18,en,34,1,1,16,,
654,FinancialTimesv3_0516.csv,4898091,15/05/2020 05:41, ,1.26115e+18,en,34,1,1,16,Twitter Web App,"PNC’s decision to sell its $17bn stake in BlackRock, the world’s biggest asset manager, was prompted by the bank’s increasing fears over the US economy, chief executive Bill Demchak told the Financial Times https://t.co/bwXRKNfDXo https://t.co/WuWV8jja7x"
3122,FinancialTimesv3_May.csv,4898091,15/05/2020 06:21, ,1.26116e+18,en,50,8,6,38,Twitter Web App,"France has warned Sanofi it would be ‘unacceptable’ for any country to have priority access to a Covid-19 vaccine, after the drugmaker’s chief suggested the US had the ‘right to the largest pre-order’ https://t.co/VbI8QsMxis"
4561,FinancialTimesv3_May1000.csv,4898091,15/05/2020 07:30, ,1.26118e+18,en,71,4,2,36,,
4562,FinancialTimesv3_May1000.csv,4898091,15/05/2020 08:01, ,1.26119e+18,en,53,6,1,36,,
644,FinancialTimesv3_0516.csv,4898091,15/05/2020 08:40, ,1.2612e+18,en,35,2,2,17,SocialFlow,Opinion: They often enter the building armed but unchallenged. Nothing brings into sharper relief America’s colour disparities than life and death in the great lockdown https://t.co/eh7GLM3ciT
641,FinancialTimesv3_0516.csv,4898091,15/05/2020 10:00, ,1.26122e+18,en,33,1,2,3,SocialFlow,"Australia gears up for an end to the lockdown. '“The beers are here and the jobs are back,” said Michael Gunner, chief minister of Northern Territory' https://t.co/Iy3tuFbCow"
3111,FinancialTimesv3_May.csv,4898091,15/05/2020 10:00, ,1.26122e+18,en,33,1,2,3,SocialFlow,"Australia gears up for an end to the lockdown. '“The beers are here and the jobs are back,” said Michael Gunner, chief minister of Northern Territory' https://t.co/Iy3tuFbCow"
4567,FinancialTimesv3_May1000.csv,4898091,15/05/2020 10:00, ,1.26122e+18,en,33,1,2,3,,
639,FinancialTimesv3_0516.csv,4898091,15/05/2020 11:00, ,1.26123e+18,en,10,0,1,6,SocialFlow,In need of more ideas for one-pot meals? Join chef and cookery writer Margot Henderson TODAY (at 12-12.30pm and 5-5.30pm UK time) for a live Q&amp;A to share tips and recipes. Post your thoughts in the comments below this story to get involved: https://t.co/Uj5cGT4PAf
638,FinancialTimesv3_0516.csv,4898091,15/05/2020 11:30, ,1.26124e+18,en,0,0,0,37,SocialFlow,RT @ncbrooker: The curse of being a millennial: those born in the late 80s entered employment during the last crisis and their earnings wer…
3108,FinancialTimesv3_May.csv,4898091,15/05/2020 11:30, ,1.26124e+18,en,0,0,0,37,SocialFlow,RT @ncbrooker: The curse of being a millennial: those born in the late 80s entered employment during the last crisis and their earnings wer…
3105,FinancialTimesv3_May.csv,4898091,15/05/2020 13:00, ,1.26127e+18,en,12,2,2,5,SocialFlow,Coronavirus latest: Covid-19 infections begin to rise in Russia https://t.co/4CsXWDrqXr
635,FinancialTimesv3_0516.csv,4898091,15/05/2020 13:00, ,1.26127e+18,en,12,2,2,5,SocialFlow,Coronavirus latest: Covid-19 infections begin to rise in Russia https://t.co/4CsXWDrqXr
4572,FinancialTimesv3_May1000.csv,4898091,15/05/2020 15:00, ,1.2613e+18,en,28,3,1,15,,
3100,FinancialTimesv3_May.csv,4898091,15/05/2020 15:30, ,1.2613e+18,en,31,1,3,8,SocialFlow,"'The case for the suit and tie is that, done right, it always feels up-to-date,' says Robert Armstrong. 'None of this can be said for the pocket watch'  https://t.co/XXHlGJoeDa"
4573,FinancialTimesv3_May1000.csv,4898091,15/05/2020 15:30, ,1.2613e+18,en,31,1,3,8,,
630,FinancialTimesv3_0516.csv,4898091,15/05/2020 15:30, ,1.2613e+18,en,31,1,3,8,SocialFlow,"'The case for the suit and tie is that, done right, it always feels up-to-date,' says Robert Armstrong. 'None of this can be said for the pocket watch'  https://t.co/XXHlGJoeDa"
3097,FinancialTimesv3_May.csv,4898091,15/05/2020 16:31, ,1.26132e+18,en,0,0,0,7,Twitter Web App,RT @lilahrap: Hello from sunny Brooklyn where I have snuck out my window to sit on a small patch of concrete that doesn't belong to me (we…
3094,FinancialTimesv3_May.csv,4898091,15/05/2020 17:26, ,1.26133e+18,en,0,0,0,0,Twitter for Advertisers.,The subtext to America’s reopening battle is thus racial https://t.co/KTOsBzr4r6
3092,FinancialTimesv3_May.csv,4898091,15/05/2020 18:00, ,1.26134e+18,en,61,4,9,31,Twitter Web App,"As Greece is getting ready to reopen its beaches, the country could be a model on how to sunbathe in an era of social distancing: https://t.co/XOfP2fE19m"
4577,FinancialTimesv3_May1000.csv,4898091,15/05/2020 18:16, ,1.26134e+18,en,44,6,11,13,,
613,FinancialTimesv3_0516.csv,4898091,15/05/2020 20:45, ,1.26138e+18,en,11,0,1,4,SocialFlow,Rising US-China tension and Covid-19 outbreaks took a toll on this week's global markets. Find out more in the FT's Markets Briefing: https://t.co/tyd0Mcom2N https://t.co/80CXOA9dAK
610,FinancialTimesv3_0516.csv,4898091,15/05/2020 22:00, ,1.2614e+18,en,28,0,2,13,SocialFlow,"Last year, Donald Trump was demanding that the US central bank cut interest rates and push the buck lower. The dollar's strength was hurting the economy, he said. But now, he is a big fan of a strong dollar. How did Covid-19 change his mind? https://t.co/LyJRHYeVb1"
4584,FinancialTimesv3_May1000.csv,4898091,15/05/2020 22:30, ,1.26141e+18,en,51,7,1,22,,
1588,FinancialTimesv3_0524.csv,4898091,15/05/2020 23:00, ,1.26142e+18,en,31,2,14,7,SocialFlow,"US President Donald Trump has vowed to deliver a coronavirus vaccine by the end of the year, launching a new project dubbed 'Operation Warp Speed' https://t.co/Y6TLwvfZMY"
4585,FinancialTimesv3_May1000.csv,4898091,15/05/2020 23:00, ,1.26142e+18,en,31,2,14,7,,
3076,FinancialTimesv3_May.csv,4898091,15/05/2020 23:30, ,1.26142e+18,en,7,1,2,5,SocialFlow,"In our latest Coronavirus Business Update newsletter: 
✔️ America has tightened export controls, targeting Huawei and its US suppliers
✔️ Care home Covid-19 deaths in England and Wales could be double the official toll https://t.co/QUPXq3HbVd"
4587,FinancialTimesv3_May1000.csv,4898091,16/05/2020 00:02, ,1.26143e+18,en,20,0,1,11,,
4589,FinancialTimesv3_May1000.csv,4898091,16/05/2020 00:32, ,1.26144e+18,en,27,2,2,19,,
3072,FinancialTimesv3_May.csv,4898091,16/05/2020 00:37, ,1.26144e+18,en,197,22,7,167,SocialFlow,Mexico tries to push through electricity market overhaul https://t.co/uUmRxjlcPn
3071,FinancialTimesv3_May.csv,4898091,16/05/2020 00:41, ,1.26144e+18,en,42,4,3,19,SocialFlow,Amazon says it will begin reopening warehouses in France https://t.co/e3ehBRGuUV
1578,FinancialTimesv3_0524.csv,4898091,16/05/2020 01:30, ,1.26145e+18,en,49,3,5,30,SocialFlow,"Addresses reveal insights into how ideas about race, class, identity and power have shifted across the centuries, argues writer Deirdre Mask https://t.co/F9I29vaYjz"
1577,FinancialTimesv3_0524.csv,4898091,16/05/2020 02:00, ,1.26146e+18,en,12,0,1,4,SocialFlow,The Encounter conjured a world so realistic that audience members turned to look for voices behind them. And now it is streaming online for free https://t.co/BPFKpDeqOK
3067,FinancialTimesv3_May.csv,4898091,16/05/2020 02:00, ,1.26146e+18,en,12,0,1,4,SocialFlow,The Encounter conjured a world so realistic that audience members turned to look for voices behind them. And now it is streaming online for free https://t.co/BPFKpDeqOK
4594,FinancialTimesv3_May1000.csv,4898091,16/05/2020 03:00, ,1.26148e+18,en,13,3,1,4,,
3064,FinancialTimesv3_May.csv,4898091,16/05/2020 03:30, ,1.26148e+18,en,34,1,3,18,SocialFlow,"Around the world, bars, restaurants, hotels and visitor attractions are being reopened as lockdowns are gradually lifted. But getting there is another matter https://t.co/ZQOjQOxPlb"
1572,FinancialTimesv3_0524.csv,4898091,16/05/2020 03:50, ,1.26149e+18,en,17,0,5,5,SocialFlow,What the secrets buried in an antique desk revealed about my family https://t.co/EsWix8KtsN
1565,FinancialTimesv3_0524.csv,4898091,16/05/2020 11:39, ,1.26161e+18,en,50,3,4,21,SocialFlow,ETF investors flock to gold and corporate bond funds https://t.co/nY1iN0prjc
4597,FinancialTimesv3_May1000.csv,4898091,16/05/2020 11:39, ,1.26161e+18,en,32,4,1,23,,
1561,FinancialTimesv3_0524.csv,4898091,16/05/2020 12:03, ,1.26161e+18,en,30,0,1,12,SocialFlow,Eat Your Books is the online directory with more than two million delicious recipes – and it's proving to be @TonyTassell's cookbook haven https://t.co/Eg8E12BEhX
3049,FinancialTimesv3_May.csv,4898091,16/05/2020 12:48, ,1.26162e+18,en,48,4,2,33,SocialFlow,Saudi wealth fund snaps up $7.7bn of US and European blue-chip stocks https://t.co/RmDyLFx1RX
1557,FinancialTimesv3_0524.csv,4898091,16/05/2020 14:06, ,1.26164e+18,en,201,31,25,125,SocialFlow,Edward Luce spoke with dozens of officials to discover what went wrong in Donald Trump’s first real crisis — and found a president who ignored increasingly urgent intelligence warnings and dismissed anyone who claimed to know more than him https://t.co/BmCsZlUw0F
3043,FinancialTimesv3_May.csv,4898091,16/05/2020 16:36, ,1.26168e+18,en,33,0,3,32,SocialFlow,Iran sentences French academic to six years in prison https://t.co/QzbV5S5OSC
3041,FinancialTimesv3_May.csv,4898091,16/05/2020 19:33, ,1.26173e+18,en,30,3,3,7,SocialFlow,Justin Amash rules out third-party run for US president https://t.co/aaLfGKeXZV
1546,FinancialTimesv3_0524.csv,4898091,17/05/2020 01:03, ,1.26181e+18,en,20,0,1,7,SocialFlow,Want to hear actress Tracee Ellis Ross talk about the garments that have helped shape her life? Or learn about why Paul Feig loves suits? These are the fashion podcasts to tune into https://t.co/o5LyM1fvym
4607,FinancialTimesv3_May1000.csv,4898091,17/05/2020 01:03, ,1.26181e+18,en,20,0,1,7,,
