,Source.Name,author id,created_at,geo,id,lang,like_count,quote_count,reply_count,retweet_count,source,tweet
3672,FinancialTimesv3_May.csv,4898091,07/05/2020 06:22, ,1.25827e+18,en,33,4,5,10,Twitter Web App,Peloton shares powered 10% higher in after-hours trading on Wednesday after the fitness group’s chief executive described it as ‘Covid-proof’ and ‘recession-proof’ https://t.co/Mg4Rv87tOr
3670,FinancialTimesv3_May.csv,4898091,07/05/2020 06:40, ,1.25827e+18,en,37,7,4,22,Twitter Web App,"After weeks of lockdown, some 115m people in China took domestic tourism trips over the May Day holiday, contributing $6.7bn to tourism revenue https://t.co/VWs9EQkimI"
242,FinancialTimesv3_0509.csv,4898091,07/05/2020 07:00, ,1.25828e+18,en,116,167,169,44,SocialFlow,"In an interview with the Financial Times, UK Labour leader Keir Starmer identified the main reason the opposition party lost the December general election: ‘the leadership’ of his predecessor, Jeremy Corbyn https://t.co/i47t1jUO7r https://t.co/UuAYbQTGGO"
241,FinancialTimesv3_0509.csv,4898091,07/05/2020 07:20, ,1.25828e+18,en,50,10,12,31,Twitter Web App,"The UK’s initial phase of lockdown relief will allow unlimited exercise, sunbathing in parks and some business operations. But it will also impose other measures, such as wearing face masks and border controls https://t.co/AR57IlFmuZ"
3667,FinancialTimesv3_May.csv,4898091,07/05/2020 07:40, ,1.25829e+18,en,256,13,14,64,SocialFlow,"FT Exclusive: Keir Starmer’s election as Labour party leader could be a watershed moment in British political history. But first, he must end an ugly, four-year civil war in the UK’s opposition party. In the FT Magazine: https://t.co/Qe0zG3LPDP https://t.co/fnxPiUXnoV"
3663,FinancialTimesv3_May.csv,4898091,07/05/2020 09:00, ,1.25831e+18,en,27,1,2,10,SocialFlow,Now might be the perfect time to teach your young ones some crucial life skills in personal finance. Lucy Warwick-Ching offers some tips: https://t.co/jPxPV897SK
4286,FinancialTimesv3_May1000.csv,4898091,07/05/2020 09:30, ,1.25831e+18,en,14,0,1,5,,
3661,FinancialTimesv3_May.csv,4898091,07/05/2020 10:00, ,1.25832e+18,en,16,1,1,5,SocialFlow,Good TV — whether you consider that Tiger King or Normal People — deserves a snack upgrade. Achieve optimal snackability with kimchi patatas from @cookinboots https://t.co/TVSQaSnyOO
3648,FinancialTimesv3_May.csv,4898091,07/05/2020 11:39, ,1.25835e+18,en,0,0,0,0,Ads Uploader for Twitter,"The UK’s initial phase of lockdown relief will allow unlimited exercise, sunbathing in parks and some business operations. But it will also impose other measures, such as wearing face masks and border controls. https://t.co/l0jqz1QYLg"
4297,FinancialTimesv3_May1000.csv,4898091,07/05/2020 11:39, ,1.25835e+18,en,5,0,0,2,,
3653,FinancialTimesv3_May.csv,4898091,07/05/2020 11:39, ,1.25835e+18,en,85,11,12,36,Ads Uploader for Twitter,"Martin Wolf: ""Debt creates fragility. The question is how to escape from the trap. To answer it, we need to analyse why today’s global economy has become so debt-dependent."" https://t.co/IFoYsoUBG1"
223,FinancialTimesv3_0509.csv,4898091,07/05/2020 11:39, ,1.25835e+18,en,27,2,3,15,Ads Uploader for Twitter,"Has Revolut, Europe's most-hyped fintech company, really changed into a financial services company with the potential to upend the banking industry? https://t.co/XPVAZNmM79"
225,FinancialTimesv3_0509.csv,4898091,07/05/2020 11:39, ,1.25835e+18,en,408,80,174,83,Ads Uploader for Twitter,Labour leader Keir Starmer has claimed that the main reason the party lost the December general election was because of “the leadership” of his hard-left predecessor Jeremy Corbyn. https://t.co/mEfBmtepDu
3635,FinancialTimesv3_May.csv,4898091,07/05/2020 11:39, ,1.25835e+18,en,0,0,0,0,Ads Uploader for Twitter,"The virus has highlighted a gulf of wellbeing between those with ready access to nature, via a garden or a park, and those without. https://t.co/Q4pRyjcx8U"
3642,FinancialTimesv3_May.csv,4898091,07/05/2020 11:39, ,1.25835e+18,en,3,0,0,3,Ads Uploader for Twitter,"HSBC has taken steps to remove the management of Singapore-based ZenRock Commodities Trading, seeking to have the company put under judicial management in the latest blow to the city-state’s natural resources sector. https://t.co/3Wq9zfVD7V"
222,FinancialTimesv3_0509.csv,4898091,07/05/2020 11:39, ,1.25835e+18,en,57,6,14,16,Ads Uploader for Twitter,"As relations deteriorate over the coronavirus, the US is weighing up more aggressive economic measures against China. https://t.co/KCAS5LxYCm"
3654,FinancialTimesv3_May.csv,4898091,07/05/2020 11:39, ,1.25835e+18,en,83,3,5,37,Ads Uploader for Twitter,"The virus has highlighted a gulf of wellbeing between those with ready access to nature, via a garden or a park, and those without. https://t.co/Mgql10pcOa"
221,FinancialTimesv3_0509.csv,4898091,07/05/2020 11:39, ,1.25835e+18,en,0,0,0,0,Ads Uploader for Twitter,"The UK’s initial phase of lockdown relief will allow unlimited exercise, sunbathing in parks and some business operations. But it will also impose other measures, such as wearing face masks and border controls. https://t.co/l0jqz1QYLg"
219,FinancialTimesv3_0509.csv,4898091,07/05/2020 11:39, ,1.25835e+18,en,0,0,0,0,Ads Uploader for Twitter,"Opinion: The WHO certainly needs to change. But it should not be defunded now, amid a global pandemic. Rather, it needs to reform in four key areas. https://t.co/AY1jC1nyAr"
3646,FinancialTimesv3_May.csv,4898091,07/05/2020 11:39, ,1.25835e+18,en,0,0,0,0,Ads Uploader for Twitter,"Opinion: The WHO certainly needs to change. But it should not be defunded now, amid a global pandemic. Rather, it needs to reform in four key areas. https://t.co/AY1jC1nyAr"
3632,FinancialTimesv3_May.csv,4898091,07/05/2020 12:30, ,1.25836e+18,en,34,0,4,23,SocialFlow,"A possible 14-day quarantine for all arrivals at UK borders will be extended to British citizens, although it may not be introduced immediately https://t.co/VpTkQSMvtw"
4304,FinancialTimesv3_May1000.csv,4898091,07/05/2020 12:30, ,1.25836e+18,en,34,0,4,23,,
202,FinancialTimesv3_0509.csv,4898091,07/05/2020 13:00, ,1.25837e+18,en,46,3,7,16,SocialFlow,"'The pre-coronavirus city has gone, and probably won’t return soon. The pandemic could change Paris even more than most cities,' Simon Kuper writes https://t.co/HsvEECNNVe"
3627,FinancialTimesv3_May.csv,4898091,07/05/2020 13:47, ,1.25838e+18,en,21,2,3,18,Twitter Web App,"Just in: More than 3m Americans filed for first time unemployment benefits last week, taking the number of applications since the coronavirus lockdowns began seven weeks ago to 33.5m https://t.co/MGLzDEz0H3"
187,FinancialTimesv3_0509.csv,4898091,07/05/2020 15:57, ,1.25841e+18,en,31,2,4,7,Ads Uploader for Twitter,Opinion: Companies are dangerously drunk on debt and it's time to start sobering up. https://t.co/jYfhOkpZ2q
3619,FinancialTimesv3_May.csv,4898091,07/05/2020 15:57, ,1.25841e+18,en,3,1,0,1,Ads Uploader for Twitter,"Gillian Tett: The global PPE shortages reveal a changing geopolitical order. With 80% of mask production occurring in China, how far should the US rely on the free market to supply these basic goods? https://t.co/rHy0Eu3zkJ"
3622,FinancialTimesv3_May.csv,4898091,07/05/2020 15:57, ,1.25841e+18,en,44,2,0,15,Ads Uploader for Twitter,Opinion: Companies are dangerously drunk on debt and it's time to start sobering up. https://t.co/UWN8ZaKqqQ
3611,FinancialTimesv3_May.csv,4898091,07/05/2020 17:00, ,1.25843e+18,en,20,2,4,10,Twitter Web App,"Neiman Marcus, the upscale department store chain, has filed for bankruptcy protection — becoming the latest retailer to be tipped over the edge by the coronavirus shutdown https://t.co/jeYjAqFGCv"
3610,FinancialTimesv3_May.csv,4898091,07/05/2020 17:25, ,1.25843e+18,en,10,0,0,1,Twitter for Advertisers.,"""I’m now deploying my own custom-made weight-loss programme, which I call the “Stop Eating Like A Bastard” diet"" https://t.co/K2PhHzgj4j"
181,FinancialTimesv3_0509.csv,4898091,07/05/2020 18:00, ,1.25844e+18,en,15,1,3,1,Twitter Web App,"Rana Foroohar: In this pandemic era, my adventures in cleaning have forced me to ponder deeper things — like what it really means to do hard physical labour for a living, spending decades without healthcare, or any real chance for upward mobility https://t.co/0vdsqFw4bQ"
4313,FinancialTimesv3_May1000.csv,4898091,07/05/2020 18:00, ,1.25844e+18,en,12,4,1,9,,
3605,FinancialTimesv3_May.csv,4898091,07/05/2020 19:00, ,1.25846e+18,en,9,0,0,4,SocialFlow,"New York has become the epicentre of the coronavirus crisis. Our NY correspondent Joshua Chaffin will be live on Instagram to chat about the state’s political response to the pandemic. Join us this Thursday, May 7 at 3pm EST (8pm BST) https://t.co/zLEPHz3fEb https://t.co/Sy45OVaUX1"
177,FinancialTimesv3_0509.csv,4898091,07/05/2020 19:30, ,1.25846e+18,en,31,2,6,14,SocialFlow,"Neiman Marcus filed for bankruptcy on Thursday, becoming the latest retailer to be tipped over by the pandemic. Read our analysis on how the crisis has proven to be a true test of the sustainability of department stores in the US https://t.co/7MEhEwTqZr https://t.co/3hoNxuwf8U"
3600,FinancialTimesv3_May.csv,4898091,07/05/2020 21:26, ,1.25849e+18,en,30,1,0,12,SocialFlow,A strong rally in tech stocks on Thursday sent the Nasdaq into positive territory for the year. https://t.co/ESfWgPEObm
164,FinancialTimesv3_0509.csv,4898091,08/05/2020 00:00, ,1.25853e+18,en,44,5,8,17,SocialFlow,"For Starmer, elected as Labour leader just five weeks ago, the pandemic has highlighted the need for a radical government. 'The nature of the task has moved on considerably,' he says https://t.co/uQZAPrSCqg"
3589,FinancialTimesv3_May.csv,4898091,08/05/2020 01:00, ,1.25855e+18,en,7,1,2,5,SocialFlow,"Hello, Hong Kong. While you were sleeping, this was our most read story: https://t.co/Gp5ZxonIru"
3584,FinancialTimesv3_May.csv,4898091,08/05/2020 05:45, ,1.25862e+18,en,98,4,10,55,SocialFlow,Top US officials said their trade pact with China remained on track despite rising tensions over the spread of the coronavirus. Follow our live coverage here: https://t.co/gb0UEz4g9t
3582,FinancialTimesv3_May.csv,4898091,08/05/2020 06:22, ,1.25863e+18,en,40,4,8,47,Twitter Web App,"Black men and women are respectively 4.2 and 4.3 times more likely to die from coronavirus than their white peers in England and Wales, according to the Office for National Statistics https://t.co/T4XRAwQswM https://t.co/lS42fWrJTs"
3579,FinancialTimesv3_May.csv,4898091,08/05/2020 07:21, ,1.25864e+18,en,50,12,6,43,Twitter Web App,"The NHS has already begun building a second coronavirus contact-tracing app, which will use technology provided by Google and Apple, following criticism of the first app it launched this week on the Isle of Wight https://t.co/qnHzv7uXPC"
151,FinancialTimesv3_0509.csv,4898091,08/05/2020 07:40, ,1.25865e+18,en,46,4,2,41,Twitter Web App,"‘Right now it’s still a big mystery,’ said Isabella Eckerle, a virologist at the Geneva Centre for Emerging Viral Diseases. ‘We don’t know what’s going on with the children.’ https://t.co/w9LmnZxiVT"
3576,FinancialTimesv3_May.csv,4898091,08/05/2020 08:20, ,1.25866e+18,en,56,11,4,28,Twitter Web App,"The architect of Sweden’s controversial coronavirus strategy has argued that by avoiding lockdown, the country will see only a small second wave of cases, unlike others that could be forced to reimpose restrictions https://t.co/ZagdDFUyZo"
148,FinancialTimesv3_0509.csv,4898091,08/05/2020 08:30, ,1.25866e+18,en,61,5,9,27,SocialFlow,Jamie Powell: 'Meat shortages present an opportunity for Beyond Meat and its competitors such as Impossible Foods to grab market share' https://t.co/orHJ1EiKpp
3575,FinancialTimesv3_May.csv,4898091,08/05/2020 08:30, ,1.25866e+18,en,61,5,9,27,SocialFlow,Jamie Powell: 'Meat shortages present an opportunity for Beyond Meat and its competitors such as Impossible Foods to grab market share' https://t.co/orHJ1EiKpp
147,FinancialTimesv3_0509.csv,4898091,08/05/2020 08:44, ,1.25866e+18,en,33,1,4,12,Twitter Web App,"Beijing’s strict travel ban, intended to prevent a second wave of coronavirus infections, has stranded Chinese nationals overseas. ‘[It’s] like your own mother told you not to come home.’ https://t.co/AmhnbRDFkb"
4331,FinancialTimesv3_May1000.csv,4898091,08/05/2020 09:00, ,1.25867e+18,en,15,0,1,3,,
146,FinancialTimesv3_0509.csv,4898091,08/05/2020 09:00, ,1.25867e+18,en,15,0,1,3,SocialFlow,Leadership in a crisis: Gambling boss's bet on a digital future pays off as he completes £10bn merger amid pandemic. https://t.co/P9IbbOxz4a
145,FinancialTimesv3_0509.csv,4898091,08/05/2020 09:30, ,1.25868e+18,en,16,0,1,7,SocialFlow,"To avoid intergenerational conflict in the workforce: 👉 navigate misconceptions 👉 empathy is crucial 👉 provide a range of communication options - email, video, webchat or phone. https://t.co/7qPstpu4nF"
1098,FinancialTimesv3_0516.csv,4898091,08/05/2020 10:00, ,1.25868e+18,en,14,0,1,2,SocialFlow,Arts lovers are going to find this summer unlike any other in living memory. So what about next year? https://t.co/XYH3VPx4tS
143,FinancialTimesv3_0509.csv,4898091,08/05/2020 10:00, ,1.25868e+18,en,19,1,2,7,SocialFlow,What Florence Nightingale can teach us about the best ways to map the spread of disease. The FT's Alan Smith speaks to cartographer Kenneth Field @kennethfield about mapping in the era of Covid-19 https://t.co/MXQvfzgzdg
4337,FinancialTimesv3_May1000.csv,4898091,08/05/2020 12:20, ,1.25872e+18,en,24,10,0,12,,
3560,FinancialTimesv3_May.csv,4898091,08/05/2020 13:00, ,1.25873e+18,en,26,1,0,9,SocialFlow,It's not just the traditional subjects that are being taught digitally. Experts say the lockdown is the perfect opportunity to give young people the financial skills they need for life https://t.co/yUr3qmqV8Z
3559,FinancialTimesv3_May.csv,4898091,08/05/2020 13:04, ,1.25873e+18,en,11,2,1,6,SocialFlow,How will we weigh the threats when we leave lockdown? https://t.co/pKrwUUd2Ti
3558,FinancialTimesv3_May.csv,4898091,08/05/2020 13:16, ,1.25873e+18,en,8,0,0,3,SocialFlow,Carnival and Southwest lead surge in US convertible bond issuance https://t.co/Fyjk0O2WMa
3557,FinancialTimesv3_May.csv,4898091,08/05/2020 13:30, ,1.25874e+18,en,44,2,1,50,SocialFlow,"Free to read: From head to foot, Covid-19 causes a fiendish variety of symptoms that are confounding the scientific community, from blood clots to strikes to digestive problems. Read more about the effort to understand coronavirus here: https://t.co/qrmQdBq6vm https://t.co/UkHqrY4XFL"
1082,FinancialTimesv3_0516.csv,4898091,08/05/2020 15:00, ,1.25876e+18,en,11,0,0,9,SocialFlow,"The US's trade pact with China remains on track despite rising tensions, American officials have said, easing fears that the pandemic had upended the two countries’ fragile economic truce https://t.co/mR9mhUOTY7"
1081,FinancialTimesv3_0516.csv,4898091,08/05/2020 15:13, ,1.25876e+18,en,0,0,0,3,Twitter Web App,RT @Tabby_Kinder: It was my turn to edit the @FT’s Long Story Short newsletter this week. Read my favourite stories of the last seven days…
4344,FinancialTimesv3_May1000.csv,4898091,08/05/2020 15:30, ,1.25877e+18,en,29,2,5,21,,
1080,FinancialTimesv3_0516.csv,4898091,08/05/2020 15:30, ,1.25877e+18,en,29,2,5,21,Twitter Web App,"The public’s fear to go back to a normal routine could undermine efforts to reopen economies, leaving the stock market’s powerful recovery vulnerable. Even in places that have partially reopened, people still avoid leaving their houses https://t.co/CpYOX5GU5N https://t.co/jIZSPjLiZt"
122,FinancialTimesv3_0509.csv,4898091,08/05/2020 16:30, ,1.25878e+18,en,34,8,9,25,SocialFlow,"The goal was to invade Venezuela by sea, overthrow the government and fly President Nicolás Maduro to the US to face justice. How did it go so wrong? https://t.co/g6HSkMyur0"
3548,FinancialTimesv3_May.csv,4898091,08/05/2020 16:30, ,1.25878e+18,en,34,8,9,25,SocialFlow,"The goal was to invade Venezuela by sea, overthrow the government and fly President Nicolás Maduro to the US to face justice. How did it go so wrong? https://t.co/g6HSkMyur0"
115,FinancialTimesv3_0509.csv,4898091,08/05/2020 19:30, ,1.25883e+18,en,15,0,1,9,SocialFlow,"Lockdowns have left property markets inactive and buyers and sellers stranded. Sales took a deep dive and, where recoveries are under way, they are fitful. As the west looks to reopen, we took a look at the state of property markets around the world https://t.co/zeAZI4Om51 https://t.co/cxwU1xqgcs"
113,FinancialTimesv3_0509.csv,4898091,08/05/2020 20:30, ,1.25884e+18,en,22,4,5,27,SocialFlow,"Richard Branson is free to sell up to half his stake in Virgin Galactic, potentially raising close to $1 billion
https://t.co/iio9AASHko"
3537,FinancialTimesv3_May.csv,4898091,08/05/2020 21:30, ,1.25886e+18,en,16,3,2,15,SocialFlow,"Just published: front page of FT Weekend, UK edition, Saturday 9 May            https://t.co/kPVSQ0pkEN https://t.co/LQZB486du9"
111,FinancialTimesv3_0509.csv,4898091,08/05/2020 21:30, ,1.25886e+18,en,16,3,2,15,SocialFlow,"Just published: front page of FT Weekend, UK edition, Saturday 9 May            https://t.co/kPVSQ0pkEN https://t.co/LQZB486du9"
1067,FinancialTimesv3_0516.csv,4898091,08/05/2020 21:30, ,1.25886e+18,en,16,3,2,15,SocialFlow,"Just published: front page of FT Weekend, UK edition, Saturday 9 May            https://t.co/kPVSQ0pkEN https://t.co/LQZB486du9"
110,FinancialTimesv3_0509.csv,4898091,08/05/2020 22:04, ,1.25887e+18,en,59,1,7,29,SocialFlow,"Simon Kuper: 'Nearly 200,000 Parisians, almost 10 per cent of the city’s population, fled to second homes or mothers in the countryside... Lord knows when the exiles will return, or whether they can afford to' https://t.co/vymV77Pqjw"
3535,FinancialTimesv3_May.csv,4898091,08/05/2020 22:15, ,1.25887e+18,en,21,2,1,16,SocialFlow,"Just published: front page of FT Weekend, international edition, Saturday 9 May            https://t.co/89pUqE9oAI https://t.co/W6rgbTuCG4"
107,FinancialTimesv3_0509.csv,4898091,08/05/2020 23:10, ,1.25888e+18,en,26,4,4,19,Twitter Web App,"The US unemployment rate surged to 14.7% in April, the highest level since the second world war https://t.co/Wg8GmZ4cIj https://t.co/EMcicA6TKo"
3532,FinancialTimesv3_May.csv,4898091,08/05/2020 23:30, ,1.25889e+18,en,21,0,3,11,SocialFlow,Apple is planning to reopen some US retail stores next week https://t.co/IxgBbXvASN
106,FinancialTimesv3_0509.csv,4898091,08/05/2020 23:30, ,1.25889e+18,en,21,0,3,11,SocialFlow,Apple is planning to reopen some US retail stores next week https://t.co/IxgBbXvASN
1062,FinancialTimesv3_0516.csv,4898091,08/05/2020 23:30, ,1.25889e+18,en,21,0,3,11,SocialFlow,Apple is planning to reopen some US retail stores next week https://t.co/IxgBbXvASN
1061,FinancialTimesv3_0516.csv,4898091,08/05/2020 23:45, ,1.25889e+18,en,17,0,2,9,SocialFlow,"A poem for VE Day. 

'There is a moment when contradictions cross,
A split of a moment when history twirls on one toe
Like a ballerina, and all men are really equal
And happiness could be impartial for once...'

(Randall Swingler)

Read more: https://t.co/URcnLMksvC"
104,FinancialTimesv3_0509.csv,4898091,09/05/2020 00:00, ,1.25889e+18,en,17,1,0,6,SocialFlow,The UK government is looking at the return of some furloughed workers on a part-time basis beyond June https://t.co/ieZW18uAbl
3530,FinancialTimesv3_May.csv,4898091,09/05/2020 00:00, ,1.25889e+18,en,17,1,0,6,SocialFlow,The UK government is looking at the return of some furloughed workers on a part-time basis beyond June https://t.co/ieZW18uAbl
3528,FinancialTimesv3_May.csv,4898091,09/05/2020 00:30, ,1.2589e+18,en,86,9,9,17,SocialFlow,"Henry Mance — It's time to face reality: Elon Musk, Tesla’s chief executive, probably isn’t going to save humanity. He’s just living his best life https://t.co/ZEVGCV2LfH"
1057,FinancialTimesv3_0516.csv,4898091,09/05/2020 01:00, ,1.25891e+18,en,57,1,5,43,SocialFlow,"As previous recessions have shown, it is long-term joblessness that is the real danger, says retired economics professor Richard Layard. How can governments save pandemic survivors from the scourge of unemployment? https://t.co/4JQ6tBk0OX"
1055,FinancialTimesv3_0516.csv,4898091,09/05/2020 01:47, ,1.25892e+18,en,14,2,0,8,SocialFlow,United Airlines yanks $2.25bn bond offering https://t.co/B8iSypXnMX
3525,FinancialTimesv3_May.csv,4898091,09/05/2020 01:47, ,1.25892e+18,en,14,2,0,8,SocialFlow,United Airlines yanks $2.25bn bond offering https://t.co/B8iSypXnMX
4364,FinancialTimesv3_May1000.csv,4898091,09/05/2020 02:00, ,1.25892e+18,en,27,0,2,15,,
1053,FinancialTimesv3_0516.csv,4898091,09/05/2020 04:03, ,1.25896e+18,en,49,4,4,19,SocialFlow,Nature heal me! Horatio Clare on three books about the healing properties of the great outdoors https://t.co/zUHCXtoPLE
3522,FinancialTimesv3_May.csv,4898091,09/05/2020 04:29, ,1.25896e+18,en,26,3,2,13,SocialFlow,Argentina misses deadline for debt restructuring deal https://t.co/jGbAbSlutg
1049,FinancialTimesv3_0516.csv,4898091,09/05/2020 04:49, ,1.25897e+18,en,57,3,0,24,SocialFlow,India’s lockdown puts squeeze on mango production https://t.co/3coDEhoH0W
1048,FinancialTimesv3_0516.csv,4898091,09/05/2020 06:00, ,1.25899e+18,en,29,1,0,4,SocialFlow,"A must-have snack for your next movie marathon: kimchi patatas topped with sesame seeds – a recipe by Ravinder Bhogal 
https://t.co/xnoPWWpjVx"
1046,FinancialTimesv3_0516.csv,4898091,09/05/2020 09:05, ,1.25903e+18,en,42,1,3,14,SocialFlow,Will the coronavirus crisis reset our relationship with the great outdoors? Join writer @HoratioClare for a live discussion TODAY (at 12pm and again at 5pm UK time). Post your questions and thoughts in the comments below this story to get involved: https://t.co/dpussOZIP9
1044,FinancialTimesv3_0516.csv,4898091,09/05/2020 10:03, ,1.25905e+18,en,21,1,2,10,SocialFlow,Who do you trust when it comes to assessing risk? Gillian Tett considers the great dilemma for states and individuals in the age of coronavirus https://t.co/FrX32GFA28
1043,FinancialTimesv3_0516.csv,4898091,09/05/2020 11:03, ,1.25906e+18,en,13,1,1,11,SocialFlow,Few precedents for grim US jobless numbers https://t.co/K0yw20yKcC
3511,FinancialTimesv3_May.csv,4898091,09/05/2020 11:05, ,1.25906e+18,en,19,1,1,7,SocialFlow,US lawmakers clash over new stimulus as jobless rate soars https://t.co/sf8heWqDOn
1040,FinancialTimesv3_0516.csv,4898091,09/05/2020 11:17, ,1.25906e+18,en,55,3,2,28,SocialFlow,US on track for worst corporate quarter since financial crisis https://t.co/05KoYBUSUy
3509,FinancialTimesv3_May.csv,4898091,09/05/2020 12:02, ,1.25908e+18,en,38,3,2,16,SocialFlow,Six films to watch this week https://t.co/4UL7Ks9pVf
3503,FinancialTimesv3_May.csv,4898091,09/05/2020 15:13, ,1.25912e+18,en,27,1,1,11,SocialFlow,UK quarantine plan poses fresh setback for aviation sector https://t.co/YVjlZSZ6II
3498,FinancialTimesv3_May.csv,4898091,09/05/2020 18:47, ,1.25918e+18,en,14,0,3,10,SocialFlow,Carlyle and GIC call off AMEX travel deal https://t.co/MVkcPnFYYk
1028,FinancialTimesv3_0516.csv,4898091,09/05/2020 18:47, ,1.25918e+18,en,14,0,3,10,SocialFlow,Carlyle and GIC call off AMEX travel deal https://t.co/MVkcPnFYYk
1026,FinancialTimesv3_0516.csv,4898091,10/05/2020 00:58, ,1.25927e+18,en,27,2,5,11,SocialFlow,Coronavirus latest: US sees decline in positive tests as key global metric eases https://t.co/5kvOBpM2bM
3494,FinancialTimesv3_May.csv,4898091,10/05/2020 02:51, ,1.2593e+18,en,40,4,6,18,SocialFlow,India faces surge in cases as economy forces ease of lockdown https://t.co/ChqYccSivs
3493,FinancialTimesv3_May.csv,4898091,10/05/2020 05:19, ,1.25934e+18,en,24,1,2,3,SocialFlow,Why I’ve had to change my mind about networking https://t.co/yxTvZaAB6D
1023,FinancialTimesv3_0516.csv,4898091,10/05/2020 05:19, ,1.25934e+18,en,24,1,2,3,SocialFlow,Why I’ve had to change my mind about networking https://t.co/yxTvZaAB6D
3490,FinancialTimesv3_May.csv,4898091,10/05/2020 07:04, ,1.25936e+18,en,55,3,3,25,SocialFlow,Now might be the perfect time to teach your young ones some crucial life skills in personal finance. Lucy Warwick-Ching offers some tips: https://t.co/VlK7PTzgmj
1019,FinancialTimesv3_0516.csv,4898091,10/05/2020 08:12, ,1.25938e+18,en,70,10,3,37,SocialFlow,Seoul nightclub cluster raises fears lockdown was eased too soon https://t.co/cmIJFlET9w
1018,FinancialTimesv3_0516.csv,4898091,10/05/2020 09:00, ,1.25939e+18,en,11,2,1,7,SocialFlow,Covid-19 is causing unprecedented disruption. How can key industries cope? How will the world look once the pandemic passes? Register to FT Global Boardroom to hear from our world class speakers as they provide key insight during these uncertain times: https://t.co/K9aQslusPL
4379,FinancialTimesv3_May1000.csv,4898091,10/05/2020 09:31, ,1.2594e+18,en,21,2,3,24,,
1016,FinancialTimesv3_0516.csv,4898091,10/05/2020 09:31, ,1.2594e+18,en,21,2,3,24,SocialFlow,How Europe splintered over contact tracing apps https://t.co/zggSixNlA3
1014,FinancialTimesv3_0516.csv,4898091,10/05/2020 11:12, ,1.25943e+18,en,62,3,3,55,SocialFlow,Millions of Americans to lose insurance as jobless rate soars https://t.co/koqUjCuTYE
4380,FinancialTimesv3_May1000.csv,4898091,10/05/2020 14:48, ,1.25948e+18,en,25,2,2,14,,
1010,FinancialTimesv3_0516.csv,4898091,10/05/2020 14:48, ,1.25948e+18,en,25,2,2,14,SocialFlow,Eastern European states sense opportunity in German court ruling https://t.co/2ZaKLvTijv
3477,FinancialTimesv3_May.csv,4898091,10/05/2020 18:27, ,1.25954e+18,en,24,0,5,11,SocialFlow,Wall St banks’ trading risk surges to highest since 2011 https://t.co/EgJeKXNPPZ
4382,FinancialTimesv3_May1000.csv,4898091,10/05/2020 18:29, ,1.25954e+18,en,36,2,5,24,,
1005,FinancialTimesv3_0516.csv,4898091,10/05/2020 18:29, ,1.25954e+18,en,36,2,5,24,SocialFlow,US officials warn jobless rate could top 20% https://t.co/Nyo0LJRGoq
